"id","username","profileURL","rating","title","review_url","asin","content","date","format_strip","verified","helpful","videoURL","video_cover_url","imgs","normalImgs"
"R3UOEW7UVQ698F","Bradley Smith","https://www.amazon.com/gp/profile/amzn1.account.AFUU6XYXO2R6ELZSWD7CMHJIJF4A/ref=cm_cr_arp_d_gw_btm?ie=UTF8","5","","https://www.amazon.com/gp/customer-reviews/R3UOEW7UVQ698F/ref=cm_cr_arp_d_rvw_ttl?ie=UTF8&ASIN=B0CFX3X5KD","B0CFX3X5KD","In my life I've been through hundreds of headphones, never was a fan of ear buds as they are always uncomfortable... I went out on a limb ordering these ones as I thought they'd be just a cheap pair of ear buds. I was wrong!<br><br>The bass quality is so perfectly balanced, the battery life is so amazing. I never have to worry about charging it. Now, I don't use it all work day long, more so, doing chores, on my way to work, and my commute to work and home.<br><br>If I had to give a negative, it's maybe the connectivity. I will mow the lawn and have my phone in my pocket and maybe twice the audio randomly cut out but it's so brief that it doesn't bother me. It could also be my phones problem.","Reviewed in the United States on May 17, 2024","Color: Black","Verified Purchase","One person found this helpful","","","[]","[]"
"R31IB747BFX4R8","Great product ","https://www.amazon.com/gp/profile/amzn1.account.AFN6ZKZ4RQ3ZQIAXI4OWF7HROWOA/ref=cm_cr_arp_d_gw_btm?ie=UTF8","4","","https://www.amazon.com/gp/customer-reviews/R31IB747BFX4R8/ref=cm_cr_arp_d_rvw_ttl?ie=UTF8&ASIN=B0CFX3X5KD","B0CFX3X5KD","They work very well. I bit uncomfortable if worn for an extended period.","Reviewed in the United States on July 1, 2024","Color: Black","Verified Purchase","","","","[]","[]"
"RQXZHFU2O8BKS","Beanstalk","https://www.amazon.com/gp/profile/amzn1.account.AGAL6RXLIUFJMHFNTNIN7LZHHBHA/ref=cm_cr_arp_d_gw_btm?ie=UTF8","4","","https://www.amazon.com/gp/customer-reviews/RQXZHFU2O8BKS/ref=cm_cr_arp_d_rvw_ttl?ie=UTF8&ASIN=B0CFX3X5KD","B0CFX3X5KD","I have been very pleasantly surprised regarding the sound quality of these earbuds. I was looking for a less expensive option (since I have a bad habit of loosing my earbuds) and these were recommended to me. For the price the sound quality is very good, there is definite base which many of the lesser priced earbuds are missing. There is very little noise canceling and the battery life is good; used them for the entire day and the battery lasted. It is the recharge time that takes a long time. But if you recharge them while you sleep your golden, the charge will last all day.","Reviewed in the United States on May 12, 2024","Color: Black","Verified Purchase","2 people found this helpful","","","[]","[]"
"R2652VMC1UGEY","Amazon Customer","https://www.amazon.com/gp/profile/amzn1.account.AGC2SQEB6BZVMRJTX2UQASBI525Q/ref=cm_cr_arp_d_gw_btm?ie=UTF8","5","","https://www.amazon.com/gp/customer-reviews/R2652VMC1UGEY/ref=cm_cr_arp_d_rvw_ttl?ie=UTF8&ASIN=B0CFX3X5KD","B0CFX3X5KD","I recently got my hands on a pair of these amazing earbuds, and I’m thrilled with my purchase. I already have a pair of earphones that I love but I do not use them for work because they cancel out the sound all around me but these work perfectly for work. They sound good when I’m answering the phone, they sounds good when I’m listening to music and most importantly, for the sound that I’m getting the price is great.  Another good thing about these earbuds is they come with three different size silicone earbud covers for your ear, which is great, you will easily find the right fit for you. You also can see the charge level immediately, no need to wonder if your earbuds are fully charged.  If you’re reading this go ahead and get yourself a pair, you won’t be sorry.","Reviewed in the United States on May 21, 2024","Color: Black","Verified Purchase","3 people found this helpful","","","[""https://m.media-amazon.com/images/I/715lsqfW--L._SY88.jpg"",""https://m.media-amazon.com/images/I/71hyxSofDuL._SY88.jpg""]","[""https://m.media-amazon.com/images/I/715lsqfW--L.jpg"",""https://m.media-amazon.com/images/I/71hyxSofDuL.jpg""]"
"R10QEP6MVGVPCM","Alexandria","https://www.amazon.com/gp/profile/amzn1.account.AGD6RGRGVP5ISWTA6ZAP6NNIYZ6A/ref=cm_cr_arp_d_gw_btm?ie=UTF8","4","","https://www.amazon.com/gp/customer-reviews/R10QEP6MVGVPCM/ref=cm_cr_arp_d_rvw_ttl?ie=UTF8&ASIN=B0CFX3X5KD","B0CFX3X5KD","Overall a great set of earbuds!I listen to books and music 4+ hours a day and these are perfect!","Reviewed in the United States on June 29, 2024","Color: Black","Verified Purchase","","","","[]","[]"
"R10EABDGTCNAJK","Mary in Michigan","https://www.amazon.com/gp/profile/amzn1.account.AH7V6D4KS3RBYHYIP2OUNJHCFGJQ/ref=cm_cr_arp_d_gw_btm?ie=UTF8","5","","https://www.amazon.com/gp/customer-reviews/R10EABDGTCNAJK/ref=cm_cr_arp_d_rvw_ttl?ie=UTF8&ASIN=B0CFX3X5KD","B0CFX3X5KD","I bought in March and it’s June and the right ear quit working… after my review they contacted me and offered me either a replacement or refund and I’m going to give it another try. I did like the size and sound of these. But I have never experienced such great customer service like this in a long time!","Reviewed in the United States on June 20, 2024","Color: Black","Verified Purchase","","","","[]","[]"
"R304IQM0B9AKOC","Marco Ocampo","https://www.amazon.com/gp/profile/amzn1.account.AHADWGWWCIAP4WOYH23EXIEG5HQA/ref=cm_cr_arp_d_gw_btm?ie=UTF8","5","","https://www.amazon.com/gp/customer-reviews/R304IQM0B9AKOC/ref=cm_cr_arp_d_rvw_ttl?ie=UTF8&ASIN=B0CFX3X5KD","B0CFX3X5KD","Easy to open, setup and charge. Quickly Bluetooth the pack to your phone. It comes with a charger via USB and USB-C. At full volume is my preference, wish it would go even higher but I will continue using it continuously.","Reviewed in the United States on July 1, 2024","Color: Black","Verified Purchase","","","","[]","[]"
"R2EQ26ZVZWDLV5","Raymond P.","https://www.amazon.com/gp/profile/amzn1.account.AGJW2HFS52546Q2U65NTBTZBC3HQ/ref=cm_cr_arp_d_gw_btm?ie=UTF8","4","","https://www.amazon.com/gp/customer-reviews/R2EQ26ZVZWDLV5/ref=cm_cr_arp_d_rvw_ttl?ie=UTF8&ASIN=B0CFX3X5KD","B0CFX3X5KD","I'm happy with this product","Reviewed in the United States on July 7, 2024","Color: Black","Verified Purchase","","","","[]","[]"
"R164UES2QEKKYF","RJM","https://www.amazon.com/gp/profile/amzn1.account.AGOSS36GJTMFT7UUGXB2UPT6G2DA/ref=cm_cr_arp_d_gw_btm?ie=UTF8","5","","https://www.amazon.com/gp/customer-reviews/R164UES2QEKKYF/ref=cm_cr_arp_d_rvw_ttl?ie=UTF8&ASIN=B0CFX3X5KD","B0CFX3X5KD","Nicely packaged. Didn't want to pair to my phone at first. I hit the bluetooth scan on my<br>Samsung A35 and got Cloud Nest ( the earbuds) to appear on the Bluetooth list. It connected flawlessly after that. Sounds OK. They are earbuds. Easy charging. Will work.","Reviewed in the United States on June 27, 2024","Color: Black","Verified Purchase","","","","[]","[]"
"R30STDR9PGBX42","Curryproductions","https://www.amazon.com/gp/profile/amzn1.account.AGFNL5EAE3ERCCLABUBC2CEJ7ZWA/ref=cm_cr_arp_d_gw_btm?ie=UTF8","5","","https://www.amazon.com/gp/customer-reviews/R30STDR9PGBX42/ref=cm_cr_arp_d_rvw_ttl?ie=UTF8&ASIN=B0CFX3X5KD","B0CFX3X5KD","Really solid performer for the price. Very bassy with clear highs as well. I had to trim the bass down via the EQ on my phone and it's balanced everything right up. But really solid unit! I really like how it shows the battery bar for each headphone as well as the whole pack.","Reviewed in the United States on June 18, 2024","Color: Black","Verified Purchase","","","","[]","[]"
"R1ZX19VH5BM2GS","Kindle Customer","https://www.amazon.com/gp/profile/amzn1.account.AG6LSM5FQHRJDEGFH72KBERY7GRA/ref=cm_cr_arp_d_gw_btm?ie=UTF8","4","","https://www.amazon.com/gp/customer-reviews/R1ZX19VH5BM2GS/ref=cm_cr_arp_d_rvw_ttl?ie=UTF8&ASIN=B0CFX3X5KD","B0CFX3X5KD","Works well especially on my long conversations with a friend miles away. She says she can hear me fine. Just wish the smaller ear buds were even a little smaller as I feel like they could fall out easily.","Reviewed in the United States on June 15, 2024","Color: Black","Verified Purchase","","","","[]","[]"
"R4S3NEXOYZYG2","Laurence Long","https://www.amazon.com/gp/profile/amzn1.account.AF6CH7ZWBQGXWX36LIX74L6D6XHQ/ref=cm_cr_arp_d_gw_btm?ie=UTF8","5","","https://www.amazon.com/gp/customer-reviews/R4S3NEXOYZYG2/ref=cm_cr_arp_d_rvw_ttl?ie=UTF8&ASIN=B0CFX3X5KD","B0CFX3X5KD","I had an issue with the earbuds and was just going to post a review of my experience with them. Shortly after posting it Bettie reached out to make sure I would be happy with their product. I did not ask for anything, they just took it upon themselves to make sure that I as a customer was happy. Excellent customer service.","Reviewed in the United States on June 14, 2024","Color: Black","Verified Purchase","","","","[]","[]"
"R2YDQQ8JLO30U6","diego","https://www.amazon.com/gp/profile/amzn1.account.AELI6KYTPBX34WLIPFZ7OMG4G6MA/ref=cm_cr_arp_d_gw_btm?ie=UTF8","5","","https://www.amazon.com/gp/customer-reviews/R2YDQQ8JLO30U6/ref=cm_cr_arp_d_rvw_ttl?ie=UTF8&ASIN=B0CFX3X5KD","B0CFX3X5KD","For the price, great sound, and a wonderful fit for my ears. Also, easy set up, and I like the fact that you can read the percentage of the charge!!","Reviewed in the United States on July 7, 2024","Color: Black","Verified Purchase","","","","[]","[]"
"R2S6MTHGHIWMY7","Amazon Customer","https://www.amazon.com/gp/profile/amzn1.account.AHBDDJ7P6RPA3SZ6AGUUQB2JEBQA/ref=cm_cr_arp_d_gw_btm?ie=UTF8","4","","https://www.amazon.com/gp/customer-reviews/R2S6MTHGHIWMY7/ref=cm_cr_arp_d_rvw_ttl?ie=UTF8&ASIN=B0CFX3X5KD","B0CFX3X5KD","Overall these are fantastic,feel good,sound very good, battery is great. My only issue is the button being on the front of the stem feels a little weird to tap and makes me feel like I'm gonna knock it out of my ear some times","Reviewed in the United States on June 2, 2024","Color: Black","Verified Purchase","2 people found this helpful","","","[]","[]"
"R307RMMOQN4Q53","Black Mom's of dallas","https://www.amazon.com/gp/profile/amzn1.account.AG4Z3ZSZMZDV6276JFKWRMBF66JA/ref=cm_cr_arp_d_gw_btm?ie=UTF8","5","","https://www.amazon.com/gp/customer-reviews/R307RMMOQN4Q53/ref=cm_cr_arp_d_rvw_ttl?ie=UTF8&ASIN=B0CFX3X5KD","B0CFX3X5KD","Just received these and used them for the first time. They are affordable and comfortable and I love the white color.<br><br>Pro- quality<br>Con- none","Reviewed in the United States on June 23, 2024","Color: Lvory White","Verified Purchase","","","","[]","[]"
"R2Y1PZFABCP20E","DAA","https://www.amazon.com/gp/profile/amzn1.account.AHHD5WVMPFTFQSUJ3LTGRS7K6JAA/ref=cm_cr_arp_d_gw_btm?ie=UTF8","4","","https://www.amazon.com/gp/customer-reviews/R2Y1PZFABCP20E/ref=cm_cr_arp_d_rvw_ttl?ie=UTF8&ASIN=B0CFX3X5KD","B0CFX3X5KD","These have much better comfort in the ears compared to another brand I had gotten. So am now testing it for durability and length of charge.","Reviewed in the United States on June 17, 2024","Color: Black","Verified Purchase","","","","[]","[]"
"R38O47I411WF9X","Ryan","https://www.amazon.com/gp/profile/amzn1.account.AH345BFCXVUT3IFQ4L4ROCE4U3MA/ref=cm_cr_arp_d_gw_btm?ie=UTF8","4","","https://www.amazon.com/gp/customer-reviews/R38O47I411WF9X/ref=cm_cr_arp_d_rvw_ttl?ie=UTF8&ASIN=B0CFX3X5KD","B0CFX3X5KD","Not the biggest fan of button placement on front-facing side of earpiece, as opposed to side-facing portion of ear, but sounds is pretty good for the price. Not much noise canceling/ top volume isnt very loud.","Reviewed in the United States on June 6, 2024","Color: Black","Verified Purchase","","","","[]","[]"
"R23T2MACUKIO5A","Anon","https://www.amazon.com/gp/profile/amzn1.account.AEE3BRIC5W6MML2DSNBCFBI2VQ3Q/ref=cm_cr_arp_d_gw_btm?ie=UTF8","5","","https://www.amazon.com/gp/customer-reviews/R23T2MACUKIO5A/ref=cm_cr_arp_d_rvw_ttl?ie=UTF8&ASIN=B0CFX3X5KD","B0CFX3X5KD","Range is very good, battery life is decent. The quality for the price is great. They are comfortable in your ear as well.","Reviewed in the United States on June 21, 2024","Color: Black","Verified Purchase","","","","[]","[]"
"R3F9WENT6IUGHL","soody","https://www.amazon.com/gp/profile/amzn1.account.AG3A6RLAKF3NZROOFRQHAWPKSOGQ/ref=cm_cr_arp_d_gw_btm?ie=UTF8","4","","https://www.amazon.com/gp/customer-reviews/R3F9WENT6IUGHL/ref=cm_cr_arp_d_rvw_ttl?ie=UTF8&ASIN=B0CFX3X5KD","B0CFX3X5KD","**** Changing my review because of great customer service. They immediately contacted me and refunded my money and offered to send me a new one if I gave them my address. I haven't done that yet though.<br><br>Connects without a problem, but neither touch button works. Not very useful.","Reviewed in the United States on May 27, 2024","Color: Black","Verified Purchase","","","","[]","[]"
"R137XSH0DGVEP","Dave in VT","https://www.amazon.com/gp/profile/amzn1.account.AGDDQ33LOVAJ6ME2K6CXKQFFMY4Q/ref=cm_cr_arp_d_gw_btm?ie=UTF8","4","","https://www.amazon.com/gp/customer-reviews/R137XSH0DGVEP/ref=cm_cr_arp_d_rvw_ttl?ie=UTF8&ASIN=B0CFX3X5KD","B0CFX3X5KD","Bought these to use on an overseas trip to share audio tour guides with my partner. Good range from the phone and good battery life. No complaints thus far.","Reviewed in the United States on June 9, 2024","Color: Black","Verified Purchase","","","","[]","[]"
"R2LUXG6K84NHTI","Catherine Malan","https://www.amazon.com/gp/profile/amzn1.account.AESO5HPSF67OKEHDTEWIRR4C5VAA/ref=cm_cr_arp_d_gw_btm?ie=UTF8","5","","https://www.amazon.com/gp/customer-reviews/R2LUXG6K84NHTI/ref=cm_cr_arp_d_rvw_ttl?ie=UTF8&ASIN=B0CFX3X5KD","B0CFX3X5KD","I got these for my son while he is in Job Corps and he loves them. Said they last almost all day and sound really good.","Reviewed in the United States on July 2, 2024","Color: Black","Verified Purchase","","","","[]","[]"
"RVMVZOP86XA4O","Ké ","https://www.amazon.com/gp/profile/amzn1.account.AGK7FSPQMU55IJ43WWJRODQAJRDQ/ref=cm_cr_arp_d_gw_btm?ie=UTF8","5","","https://www.amazon.com/gp/customer-reviews/RVMVZOP86XA4O/ref=cm_cr_arp_d_rvw_ttl?ie=UTF8&ASIN=B0CFX3X5KD","B0CFX3X5KD","What I like about these earphones is the ability to listen to music in high quality and the ability to walk around without having my phone close to me. What I found a little annoying, was that it was a bit difficult to adjust settings (Mainly Volume) without defined buttons. Other than that, I enjoy this item.","Reviewed in the United States on June 3, 2024","Color: Black","Verified Purchase","","","","[]","[]"
"R3LT453LM0FB2B","Clarissa A Purifoy","https://www.amazon.com/gp/profile/amzn1.account.AHVLFYU2OUVGEJRXDY4OI23ZRG3A/ref=cm_cr_arp_d_gw_btm?ie=UTF8","5","","https://www.amazon.com/gp/customer-reviews/R3LT453LM0FB2B/ref=cm_cr_arp_d_rvw_ttl?ie=UTF8&ASIN=B0CFX3X5KD","B0CFX3X5KD","One of the gifts for my boyfriend for his birthday. He loves them! Loves the noise cancellation and the fact that the sound lowers when he removes them from his ears to speak to someone in person. Stay charged a long time while he works.","Reviewed in the United States on June 19, 2024","Color: Black","Verified Purchase","","","","[]","[]"
"R262MQRR4O9PNU","Cindy R Brevik","https://www.amazon.com/gp/profile/amzn1.account.AFUAO6EUD2KOD4DRLW33AJULAL2A/ref=cm_cr_arp_d_gw_btm?ie=UTF8","5","","https://www.amazon.com/gp/customer-reviews/R262MQRR4O9PNU/ref=cm_cr_arp_d_rvw_ttl?ie=UTF8&ASIN=B0CFX3X5KD","B0CFX3X5KD","UPDATE!!  C/S is awesome.  They are sending another pair for me to try.<br><br>They have amazing sound. 3 stars.....Will not stay in my ears.  Have tried all 3 sizes of tips.  Can get them to turn off and on sometimes but no volume control. Was really hoping they would work for me!!","Reviewed in the United States on June 19, 2024","Color: Sky Blue","Verified Purchase","","","","[]","[]"
"R3KZYTS7W03I7D","Kindle Customer","https://www.amazon.com/gp/profile/amzn1.account.AH6P6GVOJCEPNDI56NYHGCGL322A/ref=cm_cr_arp_d_gw_btm?ie=UTF8","4","","https://www.amazon.com/gp/customer-reviews/R3KZYTS7W03I7D/ref=cm_cr_arp_d_rvw_ttl?ie=UTF8&ASIN=B0CFX3X5KD","B0CFX3X5KD","Good sound the only problem I have is they don't stand my ears but that's more the shape of my ears I think with the rubber tips","Reviewed in the United States on June 13, 2024","Color: Black","Verified Purchase","","","","[]","[]"
"R3I4P5XVQ8UEPN","elizabeth marren","https://www.amazon.com/gp/profile/amzn1.account.AHR2R2OG6N3M52JSEXWZAEFY5QYQ/ref=cm_cr_arp_d_gw_btm?ie=UTF8","5","","https://www.amazon.com/gp/customer-reviews/R3I4P5XVQ8UEPN/ref=cm_cr_arp_d_rvw_ttl?ie=UTF8&ASIN=B0CFX3X5KD","B0CFX3X5KD","I have had other More expensive earbuds, But these were the best. They stayed in my ear easily, the sound quality was great. They were easy to charge, and the storage container also indicated how much charge was left. They are very simple to use, but note there are no buttons on them So every change has to go through the phone. It works for me, but it may not be for everybody.","Reviewed in the United States on June 6, 2024","Color: Black","Verified Purchase","","","","[]","[]"
"R3P109GE73R5DP","Adam Posey","https://www.amazon.com/gp/profile/amzn1.account.AGJTTX6UAZAGZ44CUNJBAIE6ZU6Q/ref=cm_cr_arp_d_gw_btm?ie=UTF8","5","","https://www.amazon.com/gp/customer-reviews/R3P109GE73R5DP/ref=cm_cr_arp_d_rvw_ttl?ie=UTF8&ASIN=B0CFX3X5KD","B0CFX3X5KD","I haven't had them for long but these are awesome. They sound great with lots of clear bass. They hold a battery charge for a long time and fit in the ear well.  Probably the best pair I've owned,  especially for the money.","Reviewed in the United States on June 9, 2024","Color: Black","Verified Purchase","","","","[]","[]"
"R3AIXFGJN60DO3","Holly Brown","https://www.amazon.com/gp/profile/amzn1.account.AF2GJ3W7YDX4ZVWUR2CKFKTHYP5Q/ref=cm_cr_arp_d_gw_btm?ie=UTF8","5","","https://www.amazon.com/gp/customer-reviews/R3AIXFGJN60DO3/ref=cm_cr_arp_d_rvw_ttl?ie=UTF8&ASIN=B0CFX3X5KD","B0CFX3X5KD","Great Sound, fast connection. I'm worried the battery might drain fast because you can not turn them off while they are paired, but otherwise they seem like a good product. And decent price. but will be going back for the teal color ones. Battery life seems decent about two hours play on half charge probably longer on full charge.","Reviewed in the United States on June 9, 2024","Color: Black","Verified Purchase","4 people found this helpful","","","[]","[]"
"RM64OMDQ6FGRZ","Cassandra G Young","https://www.amazon.com/gp/profile/amzn1.account.AFDPBVWYSOW3JF47ZSKJLOX347YA/ref=cm_cr_arp_d_gw_btm?ie=UTF8","5","","https://www.amazon.com/gp/customer-reviews/RM64OMDQ6FGRZ/ref=cm_cr_arp_d_rvw_ttl?ie=UTF8&ASIN=B0CFX3X5KD","B0CFX3X5KD","These are top their. I have purchase 3 pair thus far. The first for my husband that said they were better than his beats by Dre. I have then purchased 2 more pair and he is right top quality at a fraction of the cost","Reviewed in the United States on June 25, 2024","Color: Black","Verified Purchase","","","","[]","[]"
"R1E51LLQDZW5ZS","Joe","https://www.amazon.com/gp/profile/amzn1.account.AFCRM5LULNBD4CKB425SCTP6HQMQ/ref=cm_cr_arp_d_gw_btm?ie=UTF8","5","","https://www.amazon.com/gp/customer-reviews/R1E51LLQDZW5ZS/ref=cm_cr_arp_d_rvw_ttl?ie=UTF8&ASIN=B0CFX3X5KD","B0CFX3X5KD","The product came as ordered and was able to be used immediately.  The buds fit comfortably and securely in the ear and the sound was very clear and precise.  I heard parts in the music that I had listened to hundreds of times that I hadn’t heard before.","Reviewed in the United States on June 22, 2024","Color: Black","Verified Purchase","","","","[]","[]"
"R1L5ADL8CZNT6K","Moodicus Maximus","https://www.amazon.com/gp/profile/amzn1.account.AE6LINOWITHYEG4MNLKBUPNZPI6Q/ref=cm_cr_arp_d_gw_btm?ie=UTF8","3","","https://www.amazon.com/gp/customer-reviews/R1L5ADL8CZNT6K/ref=cm_cr_arp_d_rvw_ttl?ie=UTF8&ASIN=B0CFX3X5KD","B0CFX3X5KD","These headphones are inconsistent, glitchy, and fall out more than the out-of-shape dude on a Company PT run...I've had these for 4 months now and I use them sparingly now. They're really just garbage. There is 0 noise cancelling. All my calls can hear everything in the background. The touch sensors don't always work right and are often plain unresponsive. If I sweat they slip out. If I run they slip out. If i jump they slip out. Laugh. Sneeze. You get the idea. I've changed the inner cushions too but no success. Don't buy these. Go with a better brand.<br><br>Update 6/11/24: Customer Service listen to my complaints about how it continued to fall out of my ear and offered to send me a new pair, but as I did not believe the design had changed, I declined. They followed up a few weeks later and asked if I would be interested in a different type of headphones that they also sold so I accepted this offer, hoping it would address the bad fit issue..it was awkward but my kid loved it so I gifted it to him..I've changed my rating from 1 to 3 because while the product is not great. As far as staying inside of the ear, the customer service is pretty outstanding and I didn't see a lot of reviews for folks having the same issues as me. Me so I don't know if I'm the outlier or the bad variable here. I'll give them the benefit of doubt and update my reading to three","Reviewed in the United States on May 2, 2024","Color: Black","Verified Purchase","","","","[]","[]"
"R22JW26ZGKA2MZ","DENNIS M.","https://www.amazon.com/gp/profile/amzn1.account.AHJOKNFJUEBR4DMTBVIFOW5Y2ZRQ/ref=cm_cr_arp_d_gw_btm?ie=UTF8","4","","https://www.amazon.com/gp/customer-reviews/R22JW26ZGKA2MZ/ref=cm_cr_arp_d_rvw_ttl?ie=UTF8&ASIN=B0CFX3X5KD","B0CFX3X5KD","I do like the deep base sound. I just wish these had higher volume as i use them in garden tractor and bush hog on tractor.","Reviewed in the United States on June 18, 2024","Color: Black","Verified Purchase","","","","[]","[]"
"R33TAUBK958HWR","A.I.T.","https://www.amazon.com/gp/profile/amzn1.account.AEW3EANNAK3NMWDN7VWB5AOVR4DQ/ref=cm_cr_arp_d_gw_btm?ie=UTF8","4","","https://www.amazon.com/gp/customer-reviews/R33TAUBK958HWR/ref=cm_cr_arp_d_rvw_ttl?ie=UTF8&ASIN=B0CFX3X5KD","B0CFX3X5KD","I can’t get it to work on my iMac laptop but it’s good for my iPhone.  The volume controls, forget it!  Can’t figure that out!","Reviewed in the United States on June 13, 2024","Color: Black","Verified Purchase","","","","[]","[]"
"RKTWL42UEPD8U","Jim E","https://www.amazon.com/gp/profile/amzn1.account.AFQLTDMAAV5U4YN3TLENQDH5MNZA/ref=cm_cr_arp_d_gw_btm?ie=UTF8","5","","https://www.amazon.com/gp/customer-reviews/RKTWL42UEPD8U/ref=cm_cr_arp_d_rvw_ttl?ie=UTF8&ASIN=B0CFX3X5KD","B0CFX3X5KD","The extra rubber tips are nice to have and are great in use.  I found the smaller rubber tips help keep the earbuds in my ears more securely.<br><br>The seller has great customer service.  Very quick to reply and resolve any issues you have have.  A great price.","Reviewed in the United States on June 4, 2024","Color: Black","Verified Purchase","","","","[]","[]"
"RX97UNZBXXJLN","PAMELA S  LEONARD","https://www.amazon.com/gp/profile/amzn1.account.AHVNMBTDSFHHSO6J4YRU4XQ73SOQ/ref=cm_cr_arp_d_gw_btm?ie=UTF8","5","","https://www.amazon.com/gp/customer-reviews/RX97UNZBXXJLN/ref=cm_cr_arp_d_rvw_ttl?ie=UTF8&ASIN=B0CFX3X5KD","B0CFX3X5KD","I love these earbuds. They do not hurt my ears,  the sound quality is great and the stay charged for a long time.","Reviewed in the United States on June 26, 2024","Color: Black","Verified Purchase","","","","[]","[]"
"R18CB02C4SWH1R","PT88","https://www.amazon.com/gp/profile/amzn1.account.AGL5KYSPXIUNADHWP62TFGCKBCJA/ref=cm_cr_arp_d_gw_btm?ie=UTF8","4","","https://www.amazon.com/gp/customer-reviews/R18CB02C4SWH1R/ref=cm_cr_arp_d_rvw_ttl?ie=UTF8&ASIN=B0CFX3X5KD","B0CFX3X5KD","Easy-to-pair with Bluetooth. Sound good. Only thing is I haven't been able to is use the touch features for volume and answer functions.","Reviewed in the United States on June 19, 2024","Color: Black","Verified Purchase","","","","[]","[]"
"R24TBHQWB4S7LX","Amazon Customer","https://www.amazon.com/gp/profile/amzn1.account.AFAW3VVCG7EUZT65454EAPXWULEQ/ref=cm_cr_arp_d_gw_btm?ie=UTF8","4","","https://www.amazon.com/gp/customer-reviews/R24TBHQWB4S7LX/ref=cm_cr_arp_d_rvw_ttl?ie=UTF8&ASIN=B0CFX3X5KD","B0CFX3X5KD","I like the fit and the price, the buttons on each earbud are a bit difficult to work with if you have acrylic nails","Reviewed in the United States on June 16, 2024","Color: Black","Verified Purchase","","","","[]","[]"
"R1RON3CKRD1DG6","Sam Bucaro","https://www.amazon.com/gp/profile/amzn1.account.AE27PWD5U44AU4LZVCSWX64X5TKQ/ref=cm_cr_arp_d_gw_btm?ie=UTF8","5","","https://www.amazon.com/gp/customer-reviews/R1RON3CKRD1DG6/ref=cm_cr_arp_d_rvw_ttl?ie=UTF8&ASIN=B0CFX3X5KD","B0CFX3X5KD","These are amazing! Great sound and long-lasting, fast charging. Easy to pair to my phone (Andoid). I wasn't looking for anything for more than to use while working out, these are absolutely great for that! Haven't tried taking a phone call with them yet, so I can't speak to that. But overall I'm super happy with these - especially for the price!","Reviewed in the United States on May 30, 2024","Color: Black","Verified Purchase","","","","[""https://m.media-amazon.com/images/I/61gazzLZD3L._SY88.jpg""]","[""https://m.media-amazon.com/images/I/61gazzLZD3L.jpg""]"
"R33EHL8SANZ7BC","karen","https://www.amazon.com/gp/profile/amzn1.account.AFQMEPPWEGH6EBVDAHYZFLWLX2GQ/ref=cm_cr_arp_d_gw_btm?ie=UTF8","5","","https://www.amazon.com/gp/customer-reviews/R33EHL8SANZ7BC/ref=cm_cr_arp_d_rvw_ttl?ie=UTF8&ASIN=B0CFX3X5KD","B0CFX3X5KD","I love these.  I use them when I am working out at the gym or at home.  They are perfect for listening to music while doing housework, and outside activities.","Reviewed in the United States on June 20, 2024","Color: Black","Verified Purchase","","","","[]","[]"
