"id","username","profileURL","rating","title","review_url","asin","content","date","format_strip","verified","helpful","videoURL","video_cover_url","imgs","normalImgs"
"R2DIKVKR1GBYSQ","fpl","https://www.amazon.com/gp/profile/amzn1.account.AEAJZM5EJH67XXN3XE54E23X7RPQ/ref=cm_cr_arp_d_gw_btm?ie=UTF8","5","","https://www.amazon.com/gp/customer-reviews/R2DIKVKR1GBYSQ/ref=cm_cr_arp_d_rvw_ttl?ie=UTF8&ASIN=B0CFX3X5KD","B0CFX3X5KD","easy to pair. sound is great. have only had for a few days but they seem to hold a good charge","Reviewed in the United States on June 28, 2024","Color: Black","Verified Purchase","","","","[]","[]"
"R238WASVEQ27TN","Ncols","https://www.amazon.com/gp/profile/amzn1.account.AHPUFHFZZCRVUHWMVSKHTLZLAHKQ/ref=cm_cr_arp_d_gw_btm?ie=UTF8","5","","https://www.amazon.com/gp/customer-reviews/R238WASVEQ27TN/ref=cm_cr_arp_d_rvw_ttl?ie=UTF8&ASIN=B0CFX3X5KD","B0CFX3X5KD","They randomly lose signal (even when standing next to the device they're paired with) and give choppy audio. They also randomly disconnect.<br><br>Edit: I've bumped my two stars to five stars. After my original post, the company did reach out on multiple occasions to offer me a full refund (which I accepted),as well as a second pair of headphones completely free (which I declined as I still use the ones I'd bought originally).An additional gift card was offered as an added apology for any inconvince. I'm really impressed by their commitment to excellent customer service.","Reviewed in the United States on May 27, 2024","Color: Black","Verified Purchase","","","","[]","[]"
"R23XU06PWCOGK3","Megan De Lisi","https://www.amazon.com/gp/profile/amzn1.account.AEEQRIIDLBGQT7BAZ7RKUMKRGQCA/ref=cm_cr_arp_d_gw_btm?ie=UTF8","5","","https://www.amazon.com/gp/customer-reviews/R23XU06PWCOGK3/ref=cm_cr_arp_d_rvw_ttl?ie=UTF8&ASIN=B0CFX3X5KD","B0CFX3X5KD","I filled out the lifetime warranty, not thinking much of it, but managed to lose an ear bud and they sent me a new pair.","Reviewed in the United States on July 5, 2024","Color: Black","Verified Purchase","","","","[]","[]"
"R2LDD0Q5HD7JE","Cheryl","https://www.amazon.com/gp/profile/amzn1.account.AEKSLRT6GPC5R5WBE65LWQJW5D5A/ref=cm_cr_arp_d_gw_btm?ie=UTF8","5","","https://www.amazon.com/gp/customer-reviews/R2LDD0Q5HD7JE/ref=cm_cr_arp_d_rvw_ttl?ie=UTF8&ASIN=B0CFX3X5KD","B0CFX3X5KD","Really good sound quality.  And comfy earbuds. They stay in my ears unlike other brands. Bought these as a spare to use at work while listening to music but they actually turned out to be so good i swapped with my main pair.","Reviewed in the United States on June 18, 2024","Color: Black","Verified Purchase","","","","[]","[]"
"R3L6IG9ZCQ83RY","Jonathan Vazquez","https://www.amazon.com/gp/profile/amzn1.account.AEUGJIMSRHHWW4QDQBNIXPVHRTUQ/ref=cm_cr_arp_d_gw_btm?ie=UTF8","4","","https://www.amazon.com/gp/customer-reviews/R3L6IG9ZCQ83RY/ref=cm_cr_arp_d_rvw_ttl?ie=UTF8&ASIN=B0CFX3X5KD","B0CFX3X5KD","Great headphones for the pricing point","Reviewed in the United States on June 15, 2024","Color: Black","Verified Purchase","","","","[]","[]"
"R3ON6JN1DVQZ6P","Kindle Customer","https://www.amazon.com/gp/profile/amzn1.account.AFJFCV35HG2YFR2PNEVZ42RQC3SA/ref=cm_cr_arp_d_gw_btm?ie=UTF8","4","","https://www.amazon.com/gp/customer-reviews/R3ON6JN1DVQZ6P/ref=cm_cr_arp_d_rvw_ttl?ie=UTF8&ASIN=B0CFX3X5KD","B0CFX3X5KD","I got these for myself to use at my office. I work on an almost empty floor and wanted an inexpensive pair of ear buds to listen to ebook or documentaries as I worked. I've been using these for a couple of months and they're decent for the price. I do have connectivity issues once in a blue moon, and the ear bud cushion things don't really have a size that is super comfortable for me, personally, but they are goon enough I use every day for almost 8 hours a day.","Reviewed in the United States on April 27, 2024","Color: Black","Verified Purchase","","","","[]","[]"
"RDMK8YLO09QFW","The sound quality is amazing! Strong base, and everything is super clear, its a nice crisp, smooth sound! My spotify has a variety of songs (almost 2,000) i tried songs from various genres from country, pop, rock (classic, modern, soft, hard) EDM, and a couple others. I am genuinely impressed with the sound quality on everything! ","https://www.amazon.com/gp/profile/amzn1.account.AE7HOUZAPI6A7KL5DBTFBE5I2BGA/ref=cm_cr_arp_d_gw_btm?ie=UTF8","5","","https://www.amazon.com/gp/customer-reviews/RDMK8YLO09QFW/ref=cm_cr_arp_d_rvw_ttl?ie=UTF8&ASIN=B0CFX3X5KD","B0CFX3X5KD","The sound quality is amazing! Strong base, and everything is super clear, its a nice crisp, smooth sound! My spotify has a variety of songs (almost 2,000) i tried songs from various genres from country, pop, rock (classic, modern, soft, hard) EDM, and a couple others. I am genuinely impressed with the sound quality on everything!","Reviewed in the United States on May 31, 2024","Color: Black","Verified Purchase","","","","[]","[]"
"RWYTC938D021H","M. B. Bey","https://www.amazon.com/gp/profile/amzn1.account.AHAHEIAOUQEPRQEECNQ5YFFKEXSA/ref=cm_cr_arp_d_gw_btm?ie=UTF8","5","","https://www.amazon.com/gp/customer-reviews/RWYTC938D021H/ref=cm_cr_arp_d_rvw_ttl?ie=UTF8&ASIN=B0CFX3X5KD","B0CFX3X5KD","I bought these because I thought I lost my Lenovo earbuds. I ended up finding them afterwards, but these didn't disappoint at all. The call quality is nice. I wish they had bigger bass for music... my personal preference, but the overall sound quality for music is above average. If you don't like heavy bass... these are perfect.","Reviewed in the United States on May 29, 2024","Color: Black","Verified Purchase","","","","[]","[]"
"R1GWL42DGVI2BH","Kathy S.","https://www.amazon.com/gp/profile/amzn1.account.AEIWEN2XP7A5DSUIR3KYX7UVT7QQ/ref=cm_cr_arp_d_gw_btm?ie=UTF8","4","","https://www.amazon.com/gp/customer-reviews/R1GWL42DGVI2BH/ref=cm_cr_arp_d_rvw_ttl?ie=UTF8&ASIN=B0CFX3X5KD","B0CFX3X5KD","They work great, but for some reason on day 2 one of them stopped working. Not sure if it's something I did? But a good value especially if they both work!","Reviewed in the United States on June 10, 2024","Color: Black","Verified Purchase","","","","[]","[]"
"R2Y9VZIIK51WAF","IB Dad","https://www.amazon.com/gp/profile/amzn1.account.AFQCRM6LZBGYYVG54MMVQMSHQXEQ/ref=cm_cr_arp_d_gw_btm?ie=UTF8","5","","https://www.amazon.com/gp/customer-reviews/R2Y9VZIIK51WAF/ref=cm_cr_arp_d_rvw_ttl?ie=UTF8&ASIN=B0CFX3X5KD","B0CFX3X5KD","Happy with these ear buds. Easy to pair, lots if functions to control with the tap buttons (volume, Play, pause, skip, etc) and I like that the case indicates charge level","Reviewed in the United States on June 20, 2024","Color: Black","Verified Purchase","","","","[]","[]"
"R34V8VJQBDOZRM","Coach 21257","https://www.amazon.com/gp/profile/amzn1.account.AFDVOSMY6EUOYOEWQVWOMBND7VQA/ref=cm_cr_arp_d_gw_btm?ie=UTF8","5","","https://www.amazon.com/gp/customer-reviews/R34V8VJQBDOZRM/ref=cm_cr_arp_d_rvw_ttl?ie=UTF8&ASIN=B0CFX3X5KD","B0CFX3X5KD","These earbuds are comfortable, and deliver good quality sound. Have not had a problem with them becoming dislodged from ears during my workouts.","Reviewed in the United States on July 5, 2024","Color: Black","Verified Purchase","","","","[]","[]"
"R2D2QPRDEO3QAG","KRA S","https://www.amazon.com/gp/profile/amzn1.account.AFQFCLDVDS3555JOUOGKWDVIAXCQ/ref=cm_cr_arp_d_gw_btm?ie=UTF8","5","","https://www.amazon.com/gp/customer-reviews/R2D2QPRDEO3QAG/ref=cm_cr_arp_d_rvw_ttl?ie=UTF8&ASIN=B0CFX3X5KD","B0CFX3X5KD","I'm pleased with the item. It meets my expectations. I am satisfied with the sound especially when I'm listening to music.","Reviewed in the United States on June 28, 2024","Color: Black","Verified Purchase","","","","[]","[]"
"R2M5J6JC994GJ","Rick Palmer","https://www.amazon.com/gp/profile/amzn1.account.AEXILHBKIPDPGHHTSUDBXPCYCYPA/ref=cm_cr_arp_d_gw_btm?ie=UTF8","5","","https://www.amazon.com/gp/customer-reviews/R2M5J6JC994GJ/ref=cm_cr_arp_d_rvw_ttl?ie=UTF8&ASIN=B0CFX3X5KD","B0CFX3X5KD","I’m totally satisfied with my earbuds AND the customer service I’ve received.  Molly is by far the nicest and easiest customer service person I’ve dealt with.  I’d never used earbuds before and I was surprised how easy they were to adjust to.  Good product.","Reviewed in the United States on June 19, 2024","Color: Sky Blue","Verified Purchase","","","","[]","[]"