"id","username","profileURL","rating","title","review_url","asin","content","date","format_strip","verified","helpful","videoURL","video_cover_url","imgs","normalImgs"
"R3DX004YD0RDHG","Edie A.","https://www.amazon.com/gp/profile/amzn1.account.AH7CUCIUNPU42DYIR3XMTQCJKC3A/ref=cm_cr_arp_d_gw_btm?ie=UTF8","5","","https://www.amazon.com/gp/customer-reviews/R3DX004YD0RDHG/ref=cm_cr_arp_d_rvw_ttl?ie=UTF8&ASIN=B0CFX3X5KD","B0CFX3X5KD","First off I have always been leary off buying earbuds due to having extremely small ear canals. After reading all the reviews, and watching the video I decided to give these puppies a try. OMG!!!<br><br>I received them three days ago, and at first I thought I was going to have to return them as the left one wouldn't work. After reading the trouble shooting I wiped the ends of both buds with a Q-tip, along with the inside of the docking station, and allowed them to charge for a couple hours Re-paired them to my phone and BINGO!<br><br>I am OLD (68) this July, and I LOVE most music, except headbanger, and rap. But my all time fav is true rock. I'm talking the Doors, The Who, CCR, Pink Floyd, Led Zeppelin...you get the idea, most of the time I only use the right bud so I can still talk with my sister, or on my landline (yes I still have one of those). Even with just one bud in the sound is phenomenal!<br><br>Last night I went to sleep with the right bud in and it stayed in all night.<br><br>My only complaint is that for my old arthritic fingers I do sometimes have an issue with them turning off when I'm trying to insert them, but hey no one ever promised me a rose garden!<br><br>These buds have  got to be the best on the market, and FYI I'm NOT getting compensated for this review. You can't go wrong, especially at this price!","Reviewed in the United States on May 14, 2024","Color: Black","Verified Purchase","8 people found this helpful","","","[]","[]"
"R3BAJPO3C865GB","William hobbs","https://www.amazon.com/gp/profile/amzn1.account.AE5RCJABU4EQ5USPNAFODAMUAZVQ/ref=cm_cr_arp_d_gw_btm?ie=UTF8","5","","https://www.amazon.com/gp/customer-reviews/R3BAJPO3C865GB/ref=cm_cr_arp_d_rvw_ttl?ie=UTF8&ASIN=B0CFX3X5KD","B0CFX3X5KD","Lots of hours but hard on the ears . If you use them for long periods. Also if you touch them they change what you were listening to.  So the one touch button needs work.<br>All that said this company listen and read the review.  And refunded my money and I didn't ask for it. I was just going to donate them to Goodwill as somebody might be able to wear them their just not right for me. Because they gave me a refund that I didn't ask for I think they deserve a 5 star for effort.","Reviewed in the United States on June 21, 2024","Color: Black","Verified Purchase","","","","[]","[]"
"RCHWJBQRDN3YF","Amber Albanese","https://www.amazon.com/gp/profile/amzn1.account.AF7QXTFQVSO4UMQYL3V2ZYAKXVXQ/ref=cm_cr_arp_d_gw_btm?ie=UTF8","5","","https://www.amazon.com/gp/customer-reviews/RCHWJBQRDN3YF/ref=cm_cr_arp_d_rvw_ttl?ie=UTF8&ASIN=B0CFX3X5KD","B0CFX3X5KD","My son gives them 5 stars<br>Good QUALITY<br>Deep Bass<br>Stability<br>Comfort FIT<br>Work out with them beautifully<br>Noise Cancelling perfect<br>Mic QUALITY excellent<br>Black color and charging case REALLY COOL!<br>THE EARPHONES CHARGE IN CASE WITHOUT BEING PLUGGED IN THE WALL-AFTER THE 1ST TIME OF CHARGING THE CASE IN AN OUTLET ON THE WALL-REALLY COOL!<br><br>CONS...<br>THEY DID NOT WORK FOR ME... MY EARS ARE SMALL... COMPLETE OPPOSITE FOR ME!!!<br><br>MY SON LOVES THEM! WE ARE SUPER GRATEFUL FOR SUCH A WONDERFUL PRODUCT! GOD BLESS THIS COMPANY AND EVERYONE THAT READS THIS! I LOVE U 2! XOX AMBER","Reviewed in the United States on June 19, 2024","Color: Black","Verified Purchase","2 people found this helpful","","","[]","[]"
"R3V42VFWQL00D4","Luke Friend","https://www.amazon.com/gp/profile/amzn1.account.AFBMBAOBG3EHZIXSCXDTTTFWBTUA/ref=cm_cr_arp_d_gw_btm?ie=UTF8","4","","https://www.amazon.com/gp/customer-reviews/R3V42VFWQL00D4/ref=cm_cr_arp_d_rvw_ttl?ie=UTF8&ASIN=B0CFX3X5KD","B0CFX3X5KD","I previously wrote a negative review about this product as mine happened to be defective in several aspects. However I give credit when and where it is due. The customer support system has been very welcoming and resolved my purchase, and made several very generous apologies. Should you unfortunately recieve a product that isn't working quite right, rest assured the team here will offer whatever support and compensation they can. They are thorough and very generous, and I sincerely hope my previous review about the product was just a one time issue, and that potential buyers enjoy the teams products","Reviewed in the United States on June 1, 2024","Color: Black","Verified Purchase","","","","[]","[]"
"R1M810XXFNWUUS","71Grande","https://www.amazon.com/gp/profile/amzn1.account.AE64QRNLXK4NVD4W3N4JWW6MYUAQ/ref=cm_cr_arp_d_gw_btm?ie=UTF8","5","","https://www.amazon.com/gp/customer-reviews/R1M810XXFNWUUS/ref=cm_cr_arp_d_rvw_ttl?ie=UTF8&ASIN=B0CFX3X5KD","B0CFX3X5KD","My first pair of ear buds; Wireless Earbuds Bluetooth V5.3 I bought them as a low cost entry into keeping my music quiet from other travelers on the planes &amp; trains. They work automatically once out of the case and paired with your phone/tablet etc. I haven't bought nor tried the expensive big name ear buds so I can't provide a comparison to those. If you need them, get them; A great entry level price for all ages.","Reviewed in the United States on June 21, 2024","Color: Black","Verified Purchase","","","","[]","[]"
"R2J6W2CR7KGTRU","Steve Strutton","https://www.amazon.com/gp/profile/amzn1.account.AHYW65BUBP2YLYONDZHBQE6BIJIA/ref=cm_cr_arp_d_gw_btm?ie=UTF8","4","","https://www.amazon.com/gp/customer-reviews/R2J6W2CR7KGTRU/ref=cm_cr_arp_d_rvw_ttl?ie=UTF8&ASIN=B0CFX3X5KD","B0CFX3X5KD","Good fit, great value. These are the buds your mom would like you to buy. They do not get loud. Lynyrd Skynyrd told me to turn it up….and I couldn’t .","Reviewed in the United States on July 6, 2024","Color: Black","Verified Purchase","","","","[]","[]"
"R1BP8STXOZC93C","Danielle M Fernald","https://www.amazon.com/gp/profile/amzn1.account.AH3BLXVHBMQO47T2M4GLK65CEOGQ/ref=cm_cr_arp_d_gw_btm?ie=UTF8","4","","https://www.amazon.com/gp/customer-reviews/R1BP8STXOZC93C/ref=cm_cr_arp_d_rvw_ttl?ie=UTF8&ASIN=B0CFX3X5KD","B0CFX3X5KD","They work well, but the volume up and down feature can be a bit finicky. The touch/tap response isn’t always perfect the spot that needs contact isn’t the most accessible when bud is in most comfortable position in my ear. I seem to prefer small ear buds, to large hurts. These are useable but if that’s something you’re seeking I still wish they were a mm or 2 smaller","Reviewed in the United States on June 14, 2024","Color: Black","Verified Purchase","One person found this helpful","","","[]","[]"
"RS602SMK87YRP","Mark","https://www.amazon.com/gp/profile/amzn1.account.AEORR4RMDRFPWE4OOZ7IHLHB6MEQ/ref=cm_cr_arp_d_gw_btm?ie=UTF8","5","","https://www.amazon.com/gp/customer-reviews/RS602SMK87YRP/ref=cm_cr_arp_d_rvw_ttl?ie=UTF8&ASIN=B0CFX3X5KD","B0CFX3X5KD","I’ve had a hard time finding decent in ear Bluetooth headphones until I tried these. The bass is great and the charger being built into the case is a great option. They last a long time before needing recharging so that’s another good thing about these headphones. I would recommend these for anyone looking for inexpensive headphones that sound good and won’t hurt your wallet.","Reviewed in the United States on June 26, 2024","Color: Black","Verified Purchase","","","","[]","[]"
"R3BV1JT4GNFZ71","j t","https://www.amazon.com/gp/profile/amzn1.account.AHUUJ7E5UWRSVD4S67Y6DL5TFS6A/ref=cm_cr_arp_d_gw_btm?ie=UTF8","5","","https://www.amazon.com/gp/customer-reviews/R3BV1JT4GNFZ71/ref=cm_cr_arp_d_rvw_ttl?ie=UTF8&ASIN=B0CFX3X5KD","B0CFX3X5KD","If u are looking for a great pair of ear buds these are definitely worth the money 💰 I have a a Samsung galaxy S20 5G. I know a lot of people with Apple phone or iPhone if u go to the music store go to your settings &amp; adjust the bass, trouble, &amp; mids it will sound better for u all even when u Bluetooth to your car stereo system. Samsung galaxy has a EQ you can adjust for the quality sound as well.","Reviewed in the United States on June 19, 2024","Color: Black","Verified Purchase","","","","[]","[]"
"R2V1S35Y6RCJUG","Dani C.","https://www.amazon.com/gp/profile/amzn1.account.AG6BUE5NWYCQZDEU373DCYDPBQWQ/ref=cm_cr_arp_d_gw_btm?ie=UTF8","5","","https://www.amazon.com/gp/customer-reviews/R2V1S35Y6RCJUG/ref=cm_cr_arp_d_rvw_ttl?ie=UTF8&ASIN=B0CFX3X5KD","B0CFX3X5KD","I updated my review after not only dealing with possibly the best customer service I've ever dealt with, for any product..The new ones they sent as of now work really well, they properly charge. I still wish the volume was higher but its a minor thing for a cheap set of earbuds..The company has been in contact with me the whole way, I didn't have to return the bad ones. I really can't complain. The product wasn't great but they went above and beyond to make it right. I've never dealt with a seller so cool and if all I have to say is the volume doesn't blow my eardrums out like I want lol then I call that a win 🤷‍♀️ I left my original review up just so everyone can see that I wasn't happy at first, but they did right by me despite a not so nice review..<br><br>Despite my negative experience with the actual earbuds. I will say after posting my review the seller contacted me, and asked how they could make it right. They offered a new pair or a full refund..I took the refund and they said it was processed in about 40 minutes. So I can't complain on that front. Crap happens, but I do appreciate when a company is willing to say Hey we messed up, lets make it right..<br><br>I bought these to replace my earbuds I had over a year. I purchased them March 16....It's March 27 and the left side won't turning , won't connect, nothing. It's dead AF..As soon as I got them the case was defective. It wouldn't charge right..I had to tap it to get it to register and charge the ear buds<br>..I loved the heavy bass on these but they are garbage and I'm so pissed. I NEED my earbuds, this isn't a casual nothing better to do situation. I use them for work and these people screwed me with their crap product....","Reviewed in the United States on March 27, 2024","Color: Black","Verified Purchase","4 people found this helpful","","","[]","[]"
"R36A5SKRMV15QD","Wassim","https://www.amazon.com/gp/profile/amzn1.account.AHXWDUIBCA6W4NJ3SQWP24M4LC4A/ref=cm_cr_arp_d_gw_btm?ie=UTF8","4","","https://www.amazon.com/gp/customer-reviews/R36A5SKRMV15QD/ref=cm_cr_arp_d_rvw_ttl?ie=UTF8&ASIN=B0CFX3X5KD","B0CFX3X5KD","It has amazing base/ bass, but the volume seems to jump from zero to 3.. not a gradual climb when unmuting..<br>Comfortable and fits well<br>Right ear bud doesn't seem to charge(connect to port) but base on other reviews,  this is probably a rare instance. It's within 30 days so I'll get a exchange and hopefully I will not have this problem again. Tbc<br>Added bonus, the company says we can register our product for worry free warranty. Wish me luck lol.  Will update upon getting new pair","Reviewed in the United States on June 1, 2024","Color: Black","Verified Purchase","","","","[]","[]"
"R1EYFGTDQJDJV1","klee05","https://www.amazon.com/gp/profile/amzn1.account.AFLC3QCQFIRWY5OG7SLCSPRQOEDQ/ref=cm_cr_arp_d_gw_btm?ie=UTF8","4","","https://www.amazon.com/gp/customer-reviews/R1EYFGTDQJDJV1/ref=cm_cr_arp_d_rvw_ttl?ie=UTF8&ASIN=B0CFX3X5KD","B0CFX3X5KD","The color is great, hold a charge well. Good sound quality. My ears are small so I always have trouble finding ear buds that fit but these do the trick and the cost is easy on the wallet 😀","Reviewed in the United States on June 26, 2024","Color: Sky Blue","Verified Purchase","","","","[]","[]"
"RRBM1F8V5WTVK","Payton","https://www.amazon.com/gp/profile/amzn1.account.AHE6LWA2AXZQP3IW26H77NQQDOWA/ref=cm_cr_arp_d_gw_btm?ie=UTF8","4","","https://www.amazon.com/gp/customer-reviews/RRBM1F8V5WTVK/ref=cm_cr_arp_d_rvw_ttl?ie=UTF8&ASIN=B0CFX3X5KD","B0CFX3X5KD","Worked for about a week. Completely stopped connecting automatically, had to put the headphones in and out of the case to start connection and then eventually stopped connecting completely. The headphones also stopped charging inside the case as well within a month. Unable to return once they stopped working according to Amazon- the company reached out to me and asked if they could replace the product themselves! They sent a full replacement and so far, so good. I have yet to experience them for a month just yet but the customer service has been excellent.","Reviewed in the United States on May 13, 2024","Color: Black","Verified Purchase","","","","[]","[]"
"R2O83OKT553ZXC","killalmt","https://www.amazon.com/gp/profile/amzn1.account.AENX6ED3NSGW5RBJXDPDTSGCE6PQ/ref=cm_cr_arp_d_gw_btm?ie=UTF8","4","","https://www.amazon.com/gp/customer-reviews/R2O83OKT553ZXC/ref=cm_cr_arp_d_rvw_ttl?ie=UTF8&ASIN=B0CFX3X5KD","B0CFX3X5KD","PRO: The sound is truly amazing and they fit really nice in my ears, no pain from having them in for a few hours.<br><br>CON: most annoyingest part is the control buttons, because they're not facing outward they're facing to the side more inward so it is so hard for me with my big hands to hit pause or turn the volume up or down. if it was on the outside part like all the other ones I'd give it a five star.<br>Yes I would recommend.","Reviewed in the United States on May 31, 2024","Color: Black","Verified Purchase","","","","[]","[]"
"R3EF0P7HK58NTF","Renee","https://www.amazon.com/gp/profile/amzn1.account.AHJ6PDQOVFM3O5R7X5VE7MFHNEEA/ref=cm_cr_arp_d_gw_btm?ie=UTF8","5","","https://www.amazon.com/gp/customer-reviews/R3EF0P7HK58NTF/ref=cm_cr_arp_d_rvw_ttl?ie=UTF8&ASIN=B0CFX3X5KD","B0CFX3X5KD","Just paired these to my new Google Pixel 7 Pro. Took a bit of time for the phone to find the device, but once it located ""Google Nest"" (per instructions), the pairing was flawless. Buds only seem to control volume (no skip to next song) but I can manually do that on my phone. Didn't see instructions for that capability so if someone has a suggestion, feel free to post response. Overall, a good purchase.","Reviewed in the United States on June 20, 2024","Color: Black","Verified Purchase","","","","[]","[]"
"RYN3GLLJBUM7I","rodolfo cardenas","https://www.amazon.com/gp/profile/amzn1.account.AGWVK2WWK6MQWKAXNCLTZZ5CUSDQ/ref=cm_cr_arp_d_gw_btm?ie=UTF8","4","","https://www.amazon.com/gp/customer-reviews/RYN3GLLJBUM7I/ref=cm_cr_arp_d_rvw_ttl?ie=UTF8&ASIN=B0CFX3X5KD","B0CFX3X5KD","I’ll wait away they fell in my ears because they’re comfortable and also like the sound","Reviewed in the United States on July 4, 2024","Color: Black","Verified Purchase","","","","[]","[]"
"R3PQM1FXZDFEPW","PandaGirl","https://www.amazon.com/gp/profile/amzn1.account.AG3TJK6XEGYUJNCV74DBSBHIH6SQ/ref=cm_cr_arp_d_gw_btm?ie=UTF8","5","","https://www.amazon.com/gp/customer-reviews/R3PQM1FXZDFEPW/ref=cm_cr_arp_d_rvw_ttl?ie=UTF8&ASIN=B0CFX3X5KD","B0CFX3X5KD","Besides the cute pink color, the Bluetooth connected quickly and allowed me to use the earbuds right out the box with very little instruction. I like that they're easily portable, have great battery life, and help me watch videos, listen to music, or make phone calls without having to deal with an annoying wire. Overall, I am very happy with this purchase. 😁","Reviewed in the United States on June 26, 2024","Color: Rose gold","Verified Purchase","","","","[]","[]"
"RRBOPTKRJGY7I","Richard J. Freiheit","https://www.amazon.com/gp/profile/amzn1.account.AGOBOP5M33GZHSWKLY67YBYBRPLA/ref=cm_cr_arp_d_gw_btm?ie=UTF8","4","","https://www.amazon.com/gp/customer-reviews/RRBOPTKRJGY7I/ref=cm_cr_arp_d_rvw_ttl?ie=UTF8&ASIN=B0CFX3X5KD","B0CFX3X5KD","I grabbed these ear buds &amp; was surprised how well they worked. Comfort is 7/10, sound 8/10. All this for under $50.","Reviewed in the United States on June 23, 2024","Color: Black","Verified Purchase","","","","[]","[]"
"R6OEE4B3VIQPS","MJ","https://www.amazon.com/gp/profile/amzn1.account.AH62LD622M72FLPZRKJ2UZ6NVUTA/ref=cm_cr_arp_d_gw_btm?ie=UTF8","5","","https://www.amazon.com/gp/customer-reviews/R6OEE4B3VIQPS/ref=cm_cr_arp_d_rvw_ttl?ie=UTF8&ASIN=B0CFX3X5KD","B0CFX3X5KD","At first I was a little hesitant about purchasing these earbuds,  but I'm happy to say I am pleased with my purchase. Charging was quick and once I opened the earbuds they immediately showed up on my phone for quick syncing.","Reviewed in the United States on July 7, 2024","Color: Black","Verified Purchase","","","","[]","[]"
"R2VH104CHXSJDJ","julie","https://www.amazon.com/gp/profile/amzn1.account.AFWSNWGDH35M3PGWZMOSWRYQD2XQ/ref=cm_cr_arp_d_gw_btm?ie=UTF8","4","","https://www.amazon.com/gp/customer-reviews/R2VH104CHXSJDJ/ref=cm_cr_arp_d_rvw_ttl?ie=UTF8&ASIN=B0CFX3X5KD","B0CFX3X5KD","easy to connect, but I can't seem to get the music to turn up louder. I ride the tractor while listening to the music but I would like it a bit loader. I used my phone volume but it doesnt seem any louder.","Reviewed in the United States on June 20, 2024","Color: Black","Verified Purchase","","","","[]","[]"
"R2DX7IAB6W6X52","Priscila","https://www.amazon.com/gp/profile/amzn1.account.AEDO4MK2HXLAZ2CGRAJWSMILHQKA/ref=cm_cr_arp_d_gw_btm?ie=UTF8","4","","https://www.amazon.com/gp/customer-reviews/R2DX7IAB6W6X52/ref=cm_cr_arp_d_rvw_ttl?ie=UTF8&ASIN=B0CFX3X5KD","B0CFX3X5KD","Good headphones, they do the job and they sound good, the only thing I find bad is the touch since it is null, they don't work at all, it doesn't raise or lower the volume, let alone talk about the other functions it should have. The headset works if you have your cell phone nearby and you do all the functions directly from the phone","Reviewed in the United States on June 7, 2024","Color: Black","Verified Purchase","One person found this helpful","","","[]","[]"
"R2FAZTD4PAARYS","Joy Juan","https://www.amazon.com/gp/profile/amzn1.account.AGK4QGHAPVPQ4NWDTUPW4XQI4VZA/ref=cm_cr_arp_d_gw_btm?ie=UTF8","5","","https://www.amazon.com/gp/customer-reviews/R2FAZTD4PAARYS/ref=cm_cr_arp_d_rvw_ttl?ie=UTF8&ASIN=B0CFX3X5KD","B0CFX3X5KD","My ex bf recommended this earbud...well I decided to purchase this right away because I was tired of the wires to my headphones. I totally agree with him! It was easy to connect to my bluetooth on my Samsung Flip phone. Package came with 3 sets of sizes of ear cushions and medium size was perfect for me. The sound quality for this price was unbelievable and I truly recommend this product.  It will surprise you! Battery life is impressive and it was easy to control the volume with my phone's volume buttons. Thank you to the product maker and seller for making this affordable.","Reviewed in the United States on June 6, 2024","Color: Black","Verified Purchase","","","","[]","[]"
"RV642FU11ILIB","JSA","https://www.amazon.com/gp/profile/amzn1.account.AF4XBZ6O3GLBATJBGA4PHVLAD5OA/ref=cm_cr_arp_d_gw_btm?ie=UTF8","4","","https://www.amazon.com/gp/customer-reviews/RV642FU11ILIB/ref=cm_cr_arp_d_rvw_ttl?ie=UTF8&ASIN=B0CFX3X5KD","B0CFX3X5KD","It’s quite good overall. The sound quality is great! The only problem is that the earbud’s mic isn’t that good. There’s always this background noise that never goes away during phone calls. Also, it can get difficult sometimes to connect to devices.","Reviewed in the United States on June 22, 2024","Color: Black","Verified Purchase","","","","[]","[]"
"R1UZUYB0Q1JPLM","Mark D. Weiner","https://www.amazon.com/gp/profile/amzn1.account.AEICYL24FQCHN72O6S4RS6D62W7Q/ref=cm_cr_arp_d_gw_btm?ie=UTF8","4","","https://www.amazon.com/gp/customer-reviews/R1UZUYB0Q1JPLM/ref=cm_cr_arp_d_rvw_ttl?ie=UTF8&ASIN=B0CFX3X5KD","B0CFX3X5KD","My right channel went out. I did hear from customer service and immediately agreed to send me a refund and a new pair  Thank you for listening to me and gaining my confidence","Reviewed in the United States on June 23, 2024","Color: Black","Verified Purchase","One person found this helpful","","","[]","[]"
"R2B6FPGH8GWQDN","Nathan walsh","https://www.amazon.com/gp/profile/amzn1.account.AG2THRESEK7EU6UQLX62MXS2VVWQ/ref=cm_cr_arp_d_gw_btm?ie=UTF8","4","","https://www.amazon.com/gp/customer-reviews/R2B6FPGH8GWQDN/ref=cm_cr_arp_d_rvw_ttl?ie=UTF8&ASIN=B0CFX3X5KD","B0CFX3X5KD","Mobility battery life is great mic quality is good color is fine music clarity is pure bliss range depending if leave ur phone dock and have interference the it fades in and out comfortable fits ear lobe","Reviewed in the United States on June 23, 2024","Color: Black","Verified Purchase","","","","[]","[]"
"R2RATNJ9LJQ700","F. Young","https://www.amazon.com/gp/profile/amzn1.account.AEVLVIFBQJYKMFIGD7KOX422UYFA/ref=cm_cr_arp_d_gw_btm?ie=UTF8","3","","https://www.amazon.com/gp/customer-reviews/R2RATNJ9LJQ700/ref=cm_cr_arp_d_rvw_ttl?ie=UTF8&ASIN=B0CFX3X5KD","B0CFX3X5KD","I had originally bought these for my daughter who asked for wireless ear buds.  I was looking for multi-point because she switches between devices, but I must have gotten confused after researching through Amazon.<br><br>So these earbuds do not have multipoint connection ability.  They can only actively pair to one device at a time.<br><br>Sound-wise, they're pretty good.  Good enough for both spoken and music/gaming.  Not the best, but I think they're more than acceptable to most people.  Calls are okay as well.<br><br>Fit wise, however, these are kinda weird.  The first time I put these in my ears, I wasn't sure if I was putting the correct sides.  There are ""L"" and ""R"" markings though, which was helpful.  But they kinda sit a little awkwardly in my ears. And the controls are also unusual, and not that intuitive;  you'll need to read the instructions to find where the controls are and how they work.<br><br>So, if you need a good backup pair of wireless earbuds, these are a good choice if you can get them at a deep discount (under $20).  If this is going to be a daily driver though, I'd keep looking.","Reviewed in the United States on June 29, 2024","Color: Black","Verified Purchase","","","","[]","[]"
"R2QK67TJEYV2NE","KatieW","https://www.amazon.com/gp/profile/amzn1.account.AEY2S3SP7PWW5ZQU6PYBKLZAUNBQ/ref=cm_cr_arp_d_gw_btm?ie=UTF8","5","","https://www.amazon.com/gp/customer-reviews/R2QK67TJEYV2NE/ref=cm_cr_arp_d_rvw_ttl?ie=UTF8&ASIN=B0CFX3X5KD","B0CFX3X5KD","The little speaker cover on one of the earbuds fell inside. No way to fix them. The company reached out to me after I posted my review and asked if they could replace the earbuds at no charge, and I didn't need to send back the broken pair. Wonderful customer service.","Reviewed in the United States on June 24, 2024","Color: Black","Verified Purchase","","","","[]","[]"
"R1FNSRQ4F75TN0","Amazon Customer","https://www.amazon.com/gp/profile/amzn1.account.AF6WTIRHEPNOCRQT3CDV4PRYCSIQ/ref=cm_cr_arp_d_gw_btm?ie=UTF8","5","","https://www.amazon.com/gp/customer-reviews/R1FNSRQ4F75TN0/ref=cm_cr_arp_d_rvw_ttl?ie=UTF8&ASIN=B0CFX3X5KD","B0CFX3X5KD","I usually have problems getting earbuds to to stay in my ears and be comfortable. These do the trick. Also sound great!  Every bit as good as those costing 10X the price.  Great value!  I would definitely recommend.  Great customer service as well.","Reviewed in the United States on July 1, 2024","Color: Black","Verified Purchase","","","","[]","[]"
"RVWX83L47VRAN","KGP","https://www.amazon.com/gp/profile/amzn1.account.AFPELW64S2HD5M3ZGRPK42E42T7A/ref=cm_cr_arp_d_gw_btm?ie=UTF8","5","","https://www.amazon.com/gp/customer-reviews/RVWX83L47VRAN/ref=cm_cr_arp_d_rvw_ttl?ie=UTF8&ASIN=B0CFX3X5KD","B0CFX3X5KD","Ordered a pair of ear buds and they was not very loud at all . Customer service reached out to me very quickly and was polite and concerned . Customer service sent me a new pair and they worked great . Customer service is A+ and will order from again . Thank you for the great customer service !","Reviewed in the United States on June 20, 2024","Color: Black","Verified Purchase","","","","[]","[]"
"R647W5NXMAOSC","Spooky","https://www.amazon.com/gp/profile/amzn1.account.AFGDVN3BJNEQZJ5TSSOTCDAP2ASA/ref=cm_cr_arp_d_gw_btm?ie=UTF8","5","","https://www.amazon.com/gp/customer-reviews/R647W5NXMAOSC/ref=cm_cr_arp_d_rvw_ttl?ie=UTF8&ASIN=B0CFX3X5KD","B0CFX3X5KD","I bought these earbuds but I received defective ones. The sound quality was still amazing despite them being defective, not only did the company that manufactured these refund me my money, they sent me a brand new pair and gave me 30 bucks. Give these earbuds a try, so at least if you don't like them, you know it's a good company making them","Reviewed in the United States on June 20, 2024","Color: Black","Verified Purchase","","","","[]","[]"
