"id","username","profileURL","rating","title","review_url","asin","content","date","format_strip","verified","helpful","videoURL","video_cover_url","imgs","normalImgs"
"RX5G08SKH7HFP","Amazon Customer","https://www.amazon.com/gp/profile/amzn1.account.AGNIMKBBVIF5MCE5SO3XCP65ESWA/ref=cm_cr_arp_d_gw_btm?ie=UTF8","5","","https://www.amazon.com/gp/customer-reviews/RX5G08SKH7HFP/ref=cm_cr_arp_d_rvw_ttl?ie=UTF8&ASIN=B09WZBPX7K","B09WZBPX7K","I received and installed this unit in early December, 2023.  I decided to wait until the battery needed to be charged before writing a review.  Today is April 10, 2024 and the unit is still working and I've not had to charge it.  To me, that's GREAT BATTERY LIFE!  I usually have about 6 to 10 motion notifications a day. (I cause most of those myself).  My unit is mounted on the front of my garage and it functions as a security camera rather than as a doorbell.<br><br>I didn't take the monthly plan and therefore, I only get a message that there's motion detected at the doorbell.  However, if I immediately check the doorbell history there will be a photo of what caused the motion.  Occasionally, I see the neighbor's cat crossing in front of my garage about 15 feet out.  It picks me up in front of my truck about 20 to 21 feet away.  Now and then, a deer rounds the corner of my garage, and it picks it up too.  It doesn't hold the images very long but you can see what's there if you look right away.  I don't have any trouble identifying what's out there.  Since I don't pay the monthly fee, for me that's not too bad!<br><br>The doorbell unit is located more than 110 feet from my computer system and cell phone inside my home.  The signal seems to me to be very good.  My garage is well-lighted and is bright in the front, so I can't say how good the unit is with night vision.<br><br>Maybe I will update this message when the battery runs down.  Update:  June 19, 2024:  The battery charge indicator showed it was almost completely discharged.  The unit has been working flawlessly.  I removed the battery and charged it today.  Hope this helps.","Reviewed in the United States on April 10, 2024","Configuration: Doorbell only","Verified Purchase","30 people found this helpful","","","[]","[]"
"RX8JHGJR2L0ZU","Marla Jo Scott","https://www.amazon.com/gp/profile/amzn1.account.AF63OLL2CUIKTOGY3PH34BQZB42A/ref=cm_cr_arp_d_gw_btm?ie=UTF8","5","","https://www.amazon.com/gp/customer-reviews/RX8JHGJR2L0ZU/ref=cm_cr_arp_d_rvw_ttl?ie=UTF8&ASIN=B09WZBPX7K","B09WZBPX7K","Love having the ring, because we have a vet long drive, and can see who's coming before they even get to the door! We don't have a doorbell so this talking feature makes it nice ecen if you're not home!","Reviewed in the United States on July 1, 2024","Configuration: Doorbell only","Verified Purchase","","","","[]","[]"
"RLHME45LIFQCY","Tina","https://www.amazon.com/gp/profile/amzn1.account.AHWS3XT5FCBPDT5KFNCPCPP6RDHQ/ref=cm_cr_arp_d_gw_btm?ie=UTF8","5","","https://www.amazon.com/gp/customer-reviews/RLHME45LIFQCY/ref=cm_cr_arp_d_rvw_ttl?ie=UTF8&ASIN=B09WZBPX7K","B09WZBPX7K","I highly recommend it. Good quality image and detection. It makes us feel safe, and the battery lasts well. The app connects us with the neighbors and alerts us of bad weather conditions and more.","Reviewed in the United States on July 5, 2024","Configuration: Doorbell only","Verified Purchase","","","","[]","[]"
"R3S67AJP2ZSAFZ","Ronnie A.","https://www.amazon.com/gp/profile/amzn1.account.AH7DMBFTSAXIFOQBGOF24DABAV5A/ref=cm_cr_arp_d_gw_btm?ie=UTF8","5","","https://www.amazon.com/gp/customer-reviews/R3S67AJP2ZSAFZ/ref=cm_cr_arp_d_rvw_ttl?ie=UTF8&ASIN=B09WZBPX7K","B09WZBPX7K","I like knowing who is at the door without looking out the window and be seen.  Also today when I wasn’t home, I saw the Amazon driver just throw the package on my porch.  Didn’t even go on the porch.","Reviewed in the United States on June 28, 2024","Configuration: Doorbell only","Verified Purchase","","","","[]","[]"
"RFCT7F442AA58","Kindle Customer","https://www.amazon.com/gp/profile/amzn1.account.AFSJPL24QDV4ALXS3UIEGGA3WZJQ/ref=cm_cr_arp_d_gw_btm?ie=UTF8","4","","https://www.amazon.com/gp/customer-reviews/RFCT7F442AA58/ref=cm_cr_arp_d_rvw_ttl?ie=UTF8&ASIN=B09WZBPX7K","B09WZBPX7K","Video quality pretty good but battery is terrible. Fully charged battery on receipt and and again after pipe work in front of house. 2 weeks later it says battery is dead. Recharged it overnight. Again it says battery is dead. Pulled battery to recharge but only the green light comes on saying it's charged. Called customer service and she had me change 1 setting (video length to 20 sec from 30 sec) to reduce battery usage (other settings were already good) and change the motion zone slightly. Then told me to charge the fully charged battery.<br><br>Edit: after posting my review I was contacted by Ring. Brett went through several actions with me. Eventually it was determined that the device was bad and a replacement was shipped to me. A bit of a hassle trying to send the original back but finally able to send it back.","Reviewed in the United States on May 1, 2024","Configuration: Doorbell only","Verified Purchase","2 people found this helpful","","","[]","[]"
"RHCWTA1Y4LRWB","Joy B.","https://www.amazon.com/gp/profile/amzn1.account.AHFZ5GIWVHDBCHO7WQFMMJVNNYBQ/ref=cm_cr_arp_d_gw_btm?ie=UTF8","5","","https://www.amazon.com/gp/customer-reviews/RHCWTA1Y4LRWB/ref=cm_cr_arp_d_rvw_ttl?ie=UTF8&ASIN=B09WZBPX7K","B09WZBPX7K","I bought this Ring camera for my front door. I live in an apartment complex that has security cameras, but only on the front side of all the buildings, which is....well whatever. We have a package thief. Plus, since our apartment is on the back (no cameras) side of the building, it just doesn't feel safe to come in and out alone sometimes, especially at night. Our apartment is upstairs, but our private entry is downstairs.  Anywho, so far, so good with the camera. The app was easy to install and I didn't have any issues with setup. I've gone through all of the categories in the settings and everything is pretty self-explanatory and easy to understand. I have it set to send me a notification on my phone and on my Echo Show when there is a person at the door. I already have a doorbell, so I'm not using that feature. My favorite part so far is my kids' reactions lol I have a 10 year old and a 16 year old and when they each got home from school yesterday, it was cute watching them make faces at the camera. I have a feeling it'll be a daily thing for awhile lol The other thing I love is the ""live"" feature. When my oldest got home, he'd forgotten his key, so I was able to talk to him from inside our apartment and let him know it was unlocked. I have a feeling that this will be one of my favorite features because I've just had ankle surgery recently, so getting up and down the stairs is a hassle. This will make it easier to ""answer the door"" without actually having to hop on one foot all the way down and back up. I'll update if I come across anything else I find helpful or any issues I might have.","Reviewed in the United States on February 29, 2024","Configuration: Doorbell only","Verified Purchase","5 people found this helpful","","","[]","[]"
"R2DKIYUEQCNDU9","Edward Ragosta","https://www.amazon.com/gp/profile/amzn1.account.AFPI32FAXZ3IBHK7U2ZJ5QNQBH3Q/ref=cm_cr_arp_d_gw_btm?ie=UTF8","4","","https://www.amazon.com/gp/customer-reviews/R2DKIYUEQCNDU9/ref=cm_cr_arp_d_rvw_ttl?ie=UTF8&ASIN=B09WZBPX7K","B09WZBPX7K","it is a good item, but directions were a little confusing and after going over them several times, I decided not to even try installing it, and that was the reason I returned it instead of opening it and playing with it. I suggest anyone buying this have some kind of knowledge of how to install an electronic doorbell of this type. !","Reviewed in the United States on June 14, 2024","Configuration: Doorbell only","Verified Purchase","One person found this helpful","","","[]","[]"
"RK7GYY580IU9C","gtek","https://www.amazon.com/gp/profile/amzn1.account.AFM4W6MGASJ7KHNCH7MYTMEGMRXA/ref=cm_cr_arp_d_gw_btm?ie=UTF8","5","","https://www.amazon.com/gp/customer-reviews/RK7GYY580IU9C/ref=cm_cr_arp_d_rvw_ttl?ie=UTF8&ASIN=B09WZBPX7K","B09WZBPX7K","Motion detector is not delayed night vision is good  the hdr is clear kind of like 2K sound quality is great mounting is sticker or no sticker lighting is good too 10/10","Reviewed in the United States on June 27, 2024","Configuration: Doorbell only","Verified Purchase","","","","[]","[]"
"R2J8SBM9IZW2Y9","The Donald","https://www.amazon.com/gp/profile/amzn1.account.AFIP4OQT2WQZTPHT5K7MRU45F5JQ/ref=cm_cr_arp_d_gw_btm?ie=UTF8","5","","https://www.amazon.com/gp/customer-reviews/R2J8SBM9IZW2Y9/ref=cm_cr_arp_d_rvw_ttl?ie=UTF8&ASIN=B09WZBPX7K","B09WZBPX7K","I've had a battery Ring for a few years now and decided to add another covering my back door/garage.  These work well once you get them set up the way you want. I keep extra battery packs charged up and ready to change when needed so I don't lose coverage.  I also have a Chime ringer indoors to let my dogs know if anything is detected so they don't have to stare out the windows all day.","Reviewed in the United States on June 5, 2024","Configuration: Doorbell only","Verified Purchase","One person found this helpful","","","[]","[]"
"R22BO1DAM3RMSX","HonestButFair","https://www.amazon.com/gp/profile/amzn1.account.AFG4LAWUVDBOET6RCEKQCRJ3MPAA/ref=cm_cr_arp_d_gw_btm?ie=UTF8","5","","https://www.amazon.com/gp/customer-reviews/R22BO1DAM3RMSX/ref=cm_cr_arp_d_rvw_ttl?ie=UTF8&ASIN=B09WZBPX7K","B09WZBPX7K","I purchased this to replace an older model Ring Doorbell that required me to remove the entire device to charge it. I’m loving the ability to quick release and charge only te battery pack. Free pro tip: I purchased the battery packs and charger so I always have a fully charged battery ready to switch out when the one in the doorbell needs to be charged. This upgrade has already saved me a lot of time and effort. I highly recommend Ring Doorbell and all Ring products, especially the battery operated devices for outdoors if you live somewhere that you cannot hard wire your devices.<br><br>I was able to easily remove the previous device I had mounted with super strength outdoor double sided mounting tape (a little extra elbow grease and a scraper to remove the residual tape) and mount this new device with the mount that is made for wireless mounting (the first Gen doorbell and mount  I had wasn’t designed to be mounted with tape but I made it work for my purposes and I was elated that Ring now has a mount specifically designed for the exact purpose I needed!)<br><br>I can’t recommend Ring products enough. They are reliable, easy to use, have great customer service, and are very durable. I purchase a plan from Ring to be able to store all of the recordings from my different devices and I absolutely love the Ring app for managing the devices all in one place. I’m aware there are many different products available now, and some are cheaper, but Ring works and you get what you pay for! 5 stars from a loyal multi-Ring doorbell and cam owner!","Reviewed in the United States on March 21, 2024","Configuration: Doorbell only","Verified Purchase","16 people found this helpful","","","[]","[]"
"R12L92ZBY4ZSXX","Vickie L Sage","https://www.amazon.com/gp/profile/amzn1.account.AG6DZ6ETD2GBSRPZB6A34QO2WINA/ref=cm_cr_arp_d_gw_btm?ie=UTF8","5","","https://www.amazon.com/gp/customer-reviews/R12L92ZBY4ZSXX/ref=cm_cr_arp_d_rvw_ttl?ie=UTF8&ASIN=B09WZBPX7K","B09WZBPX7K","We live out in the country, and I work from home. I feel so much safer working from home now that we have this. I love that I get notified as soon as it detects motion.","Reviewed in the United States on June 27, 2024","Configuration: Doorbell only","Verified Purchase","","","","[]","[]"
"R1JZSPDZA9ICRS","HJB","https://www.amazon.com/gp/profile/amzn1.account.AH37HPZBPCMQLHBCFK7GEAE5QNWQ/ref=cm_cr_arp_d_gw_btm?ie=UTF8","3","","https://www.amazon.com/gp/customer-reviews/R1JZSPDZA9ICRS/ref=cm_cr_arp_d_rvw_ttl?ie=UTF8&ASIN=B09WZBPX7K","B09WZBPX7K","1. The doorbell works fine, as a doorbell that sounds over my various alexa enabled devices. Very good since I have them around the house and wherever we are we know when the doorbell is pressed.<br><br>2. The battery has to be recharged every few weeks. I had hoped for a couple of months.<br><br>3,. The big disappointments were the captured videos and the movement detection.  The device comes with a one month subscription to an Amazon security service.  So, for the first month, the movement detection worked fine as did the video capture function.  Once the subscription was over, movement detection became unreliable, and leaves and birds and cars on the street 5 feet away. Similarly, without the subscription, the system does not capture videos.  IT will only show live video.  So, if a bell push or movement causes an alert to you, and you are delayed getting to your video screen, and the person has going away, you have no way of knowing who had been at the door or if the alert was due to a moving leaf.<br><br>There is no good reason for the lack of video capture, since most people have a computer than can act as a server.  It would seem that the feature is not made available because Amazon wants to capture monthly and annual subscriptions<br><br>The problem with motion detection is at caused by the fact that, when the you do not subscribe, Amazon no longer gives you access to an intelligent recognition feature. The problem is compounded because the doorbell camera cannot be adjusted as to whee it is aimed.<br><br>I already had a camera on my front door and it gives an excellent picture and intelligent alert and it stores all videos on my system. So I use the Ring doorbell as a doorbell only, and I turned off the video and movement feature.<br><br>Uless you are happy to buy a subscription, I do not recommend this doorbell camera.","Reviewed in the United States on May 27, 2024","Configuration: Doorbell only","Verified Purchase","5 people found this helpful","","","[]","[]"
"RFQQGZRUG2GM1","Fred Lomax III","https://www.amazon.com/gp/profile/amzn1.account.AFNVUWSHR62LZLEMZKVGP4ZTJPNA/ref=cm_cr_arp_d_gw_btm?ie=UTF8","5","","https://www.amazon.com/gp/customer-reviews/RFQQGZRUG2GM1/ref=cm_cr_arp_d_rvw_ttl?ie=UTF8&ASIN=B09WZBPX7K","B09WZBPX7K","If you have 5g network, be sure to get the 2024 ring. Love my ring doorbells.","Reviewed in the United States on July 6, 2024","Configuration: Doorbell only","Verified Purchase","","","","[]","[]"
"R1QU19MCKQ519A","Glenn","https://www.amazon.com/gp/profile/amzn1.account.AFZDNGUQWBLDXUBOL36Y2TNAPBIA/ref=cm_cr_arp_d_gw_btm?ie=UTF8","5","","https://www.amazon.com/gp/customer-reviews/R1QU19MCKQ519A/ref=cm_cr_arp_d_rvw_ttl?ie=UTF8&ASIN=B09WZBPX7K","B09WZBPX7K","My daughter has been using this product for 21 days now and the battery life is still at 60%! She installed it herself and it works very well. She has not encountered any problems with it.","Reviewed in the United States on June 20, 2024","Configuration: Doorbell only","Verified Purchase","","","","[]","[]"
"RIQJ3KSA4Y14M","Nicholas","https://www.amazon.com/gp/profile/amzn1.account.AEDLF4QOCH52Y2JLEKWDPG6M76NA/ref=cm_cr_arp_d_gw_btm?ie=UTF8","4","","https://www.amazon.com/gp/customer-reviews/RIQJ3KSA4Y14M/ref=cm_cr_arp_d_rvw_ttl?ie=UTF8&ASIN=B09WZBPX7K","B09WZBPX7K","My new door bell hadn’t lived up to its full potential yet. Still exploring.","Reviewed in the United States on July 1, 2024","Configuration: Doorbell only","Verified Purchase","","","","[]","[]"
"RGEAUPED5XJDG","L. Richardson","https://www.amazon.com/gp/profile/amzn1.account.AENXTOTMKHPKWZCYCOQBSDTGMH2A/ref=cm_cr_arp_d_gw_btm?ie=UTF8","5","","https://www.amazon.com/gp/customer-reviews/RGEAUPED5XJDG/ref=cm_cr_arp_d_rvw_ttl?ie=UTF8&ASIN=B09WZBPX7K","B09WZBPX7K","Moving from (free Arlo) to paid Ring. The camera is updated and high quality.","Reviewed in the United States on July 7, 2024","Configuration: Doorbell only","Verified Purchase","","","","[]","[]"
"R2ZPBFN1UU4T6X","Ronald W","https://www.amazon.com/gp/profile/amzn1.account.AHRPSC37BALLTCLHC4F5UOL44M5A/ref=cm_cr_arp_d_gw_btm?ie=UTF8","4","","https://www.amazon.com/gp/customer-reviews/R2ZPBFN1UU4T6X/ref=cm_cr_arp_d_rvw_ttl?ie=UTF8&ASIN=B09WZBPX7K","B09WZBPX7K","I've went through 2 of these already. Both lasted a month a piece and then shot the 💩. Come on Amazon do better.<br>Edit: I did manage to get the 2nd one back up and running again. It sometimes fails to shoot a live video but if you are controlling the doorbell from an Android phone I found if you turn WI-FI on you phone off, it will shoot live video again through the mobile network.","Reviewed in the United States on May 30, 2024","Configuration: Doorbell only","Verified Purchase","One person found this helpful","","","[]","[]"
"R1QA2B2S7VDZNK","Smatha Edward","https://www.amazon.com/gp/profile/amzn1.account.AHOS6XSPKMIAXR5X2PB3HYC2Z4DQ/ref=cm_cr_arp_d_gw_btm?ie=UTF8","4","","https://www.amazon.com/gp/customer-reviews/R1QA2B2S7VDZNK/ref=cm_cr_arp_d_rvw_ttl?ie=UTF8&ASIN=B09WZBPX7K","B09WZBPX7K","I chose the most recent edition 2023, why compare the older one, I had a 2020 one, the new edition's battery ran out so fast, maybe 2 weeks need to replace, I ordered another two battery to prepare for the replacement. A little disappoitment.","Reviewed in the United States on June 10, 2024","Configuration: Doorbell only","Verified Purchase","","","","[]","[]"
"R3QBT2V0CSNB5Z","Irene","https://www.amazon.com/gp/profile/amzn1.account.AHHGYFSNJELXOAGTRPY2A3M7D4LQ/ref=cm_cr_arp_d_gw_btm?ie=UTF8","4","","https://www.amazon.com/gp/customer-reviews/R3QBT2V0CSNB5Z/ref=cm_cr_arp_d_rvw_ttl?ie=UTF8&ASIN=B09WZBPX7K","B09WZBPX7K","I love the camera, it captures a lot and has a wide side to side view.  I can see all the way to the street but there is a few seconds delay before it capturs video.  Battery charge lasted more than 3 months. I bought an extra battery, swapped it out easy, sound is good, no connection issues, I think it was whorth the purchase.","Reviewed in the United States on June 3, 2024","Configuration: Doorbell only","Verified Purchase","One person found this helpful","","","[]","[]"
"R2ULUU89CZTP81","Cielo","https://www.amazon.com/gp/profile/amzn1.account.AHNITBKNHBPVYMOWXAN2WF5WWZLQ/ref=cm_cr_arp_d_gw_btm?ie=UTF8","5","","https://www.amazon.com/gp/customer-reviews/R2ULUU89CZTP81/ref=cm_cr_arp_d_rvw_ttl?ie=UTF8&ASIN=B09WZBPX7K","B09WZBPX7K","It comes with the Chime and sync’s perfectly. Excellent purchase!!","Reviewed in the United States on July 8, 2024","Configuration: Doorbell only","Verified Purchase","","","","[]","[]"
"R1OWKUIR3L0CO","Wil smooth","https://www.amazon.com/gp/profile/amzn1.account.AEL3OE5A5YSEKC7GURZJKE5VSOHQ/ref=cm_cr_arp_d_gw_btm?ie=UTF8","5","","https://www.amazon.com/gp/customer-reviews/R1OWKUIR3L0CO/ref=cm_cr_arp_d_rvw_ttl?ie=UTF8&ASIN=B09WZBPX7K","B09WZBPX7K","A most for security. In this dam age security its a most and this does it well ...","Reviewed in the United States on July 1, 2024","Configuration: Doorbell only","Verified Purchase","","","","[]","[]"
"R1TJUE1TN5O3GC","Gio","https://www.amazon.com/gp/profile/amzn1.account.AFOZF5P6JC7FLDUISXS6TP4U7X7Q/ref=cm_cr_arp_d_gw_btm?ie=UTF8","4","","https://www.amazon.com/gp/customer-reviews/R1TJUE1TN5O3GC/ref=cm_cr_arp_d_rvw_ttl?ie=UTF8&ASIN=B09WZBPX7K","B09WZBPX7K","You would think after so many years they would be able to make a ring doorbell camera that is high definition. Not just up close, but that is able to read license plates and make out faces that pull up in front of your home.","Reviewed in the United States on June 12, 2024","Configuration: Doorbell only","Verified Purchase","","","","[]","[]"
"R1S3BLFE2WPV0F","Citlali","https://www.amazon.com/gp/profile/amzn1.account.AHTZK2ZGJTO3CDTVBARCMAKHV55A/ref=cm_cr_arp_d_gw_btm?ie=UTF8","5","","https://www.amazon.com/gp/customer-reviews/R1S3BLFE2WPV0F/ref=cm_cr_arp_d_rvw_ttl?ie=UTF8&ASIN=B09WZBPX7K","B09WZBPX7K","Easy and good quality in the camera we have 6 ring door bells for our homes🩷","Reviewed in the United States on June 30, 2024","Configuration: Doorbell only","Verified Purchase","","","","[]","[]"
"R11FP2DR440697","FloridaJC","https://www.amazon.com/gp/profile/amzn1.account.AH3LVQX6JAGDXR5CHGGOZTGDXBVQ/ref=cm_cr_arp_d_gw_btm?ie=UTF8","5","","https://www.amazon.com/gp/customer-reviews/R11FP2DR440697/ref=cm_cr_arp_d_rvw_ttl?ie=UTF8&ASIN=B09WZBPX7K","B09WZBPX7K","The installation took some time, primarily because I had to drill into a block wall to mount it, plus I needed it to work with my existing mechanical chime. There's a bit of a learning curve to really understand exactly how everything works, but the final result is beyond impressive. After 30 days, you have to subscribe to a Ring protection plan to keep all the advanced recording and storage features going, but they're pretty cheap. I got the intermediate plan for $10 a month. In short, I totally love this thing.","Reviewed in the United States on May 24, 2024","Configuration: Doorbell only","Verified Purchase","5 people found this helpful","","","[]","[]"
"R3BT4F94P72W74","Ryan Dubbs","https://www.amazon.com/gp/profile/amzn1.account.AHUDER4YU23PODC6UVAHFHLTKMZA/ref=cm_cr_arp_d_gw_btm?ie=UTF8","5","","https://www.amazon.com/gp/customer-reviews/R3BT4F94P72W74/ref=cm_cr_arp_d_rvw_ttl?ie=UTF8&ASIN=B09WZBPX7K","B09WZBPX7K","I have good number of cameras,  doorbells, and alexa devices all configured and paired together.  I bought this doorbell to upgrade my front door.  Wow is it nice!!  I really can see the difference in verticle resolution.<br><br>These have a lot of great options and features that really give you good control over your devices with a few major cons that really are hard to overlook and should cost a few stars.<br><br>Pros.  Great alerts,  great video quality for just 1080p,  range, and night vision.  I can have it setup so if my front door gets motion alert, all the flood lights and cameras that can see that area light up and record.  You can share with family members and determine what cameras they can see and which they cannot.  I.E. we have a bedroom cam for our rottweiler puppy that has a large crate we can see right into during these early training months.  I'd rather not having my teenage kids seeing into my bedroom but them getting motion alerts for the doors is awesome.<br><br>Cons.  Local storage is blocked behind a paywall.  I literally bought a 512gb microsd card and found out when I couldn't find where to enable that you have to not just pay more than what I was before with one camera,  but you have to move up to their most expensive 20 dollar a month plan!!!  What... The...heck Ring!??!  I'm reading also that even after you do this,  you can't use both cloud AND local storage..  This is double dumb and downright either HORRENDOUS design by the developers or just intentional extortion via nickel and diming of their already paying customers.<br><br>I'm a 25+ year IT professional.  In EVERY camera system or data suite you care about,  local and cloud storage together IS the bee's knees.  It should be available on cloud no matter what in case of fire/ring alarm theft and local storage used for faster replaying of recent events up to the amount of data your SD card can hold.<br><br>Rather than giving in and paying,  I returned the SD card and said screw it.  I previously was paying about 3.99 a month for my single ring camera.  I got tired of maintaining my local IP camera setup and needing a vm (virtual machine) running to record and eating up storage on my NAS to save it all.  I was stoked when I saw the local storage.  I dropped over 500 bucks on doorbell cams for back and side doors,  flood light cams,  and interior cameras to ensure our pets left home are fine and being checked on when we go on longer trips.  I was OK moving up to 10 dollars a month for all that I get.  Adding another 10 on top for something that costs RING NOTHING for me to use. is unacceptable.  This is just a money-grabbing paywall and it needs to stop.<br><br>Lastly,  the biggest operational con besides this is the poor integration with Alexa for scheduling camera functions.  I.E.  I do like getting driveway alerts via the alexa when motion is detected because its a blind spot inside my house.  One window on the back side of the house can see the driveway due to garage location.  I set a schedule or snooze it to not give motion alerts if I'm having people over and it completely ignores this schedule and gives endless motion alerts via the alexa devices.  Stupid annoying and it seems people have been complaining about this on the forum since 2018.","Reviewed in the United States on June 21, 2023","Configuration: Doorbell only","Verified Purchase","304 people found this helpful","","","[]","[]"
"R1QR96UL016R43","Madan Gautam","https://www.amazon.com/gp/profile/amzn1.account.AGHM4WX6FW6NJMITD37MDWHX6SAA/ref=cm_cr_arp_d_gw_btm?ie=UTF8","5","","https://www.amazon.com/gp/customer-reviews/R1QR96UL016R43/ref=cm_cr_arp_d_rvw_ttl?ie=UTF8&ASIN=B09WZBPX7K","B09WZBPX7K","Great product, I have ring cameras around my house. This was by far the easiest one to install. I was able to take my doorbell out and put this one back on in about 5 minutes. Hard wiring is so simple!","Reviewed in the United States on June 5, 2024","Configuration: Doorbell only","Verified Purchase","One person found this helpful","","","[]","[]"
