"id","username","profileURL","rating","title","review_url","asin","content","date","format_strip","verified","helpful","videoURL","video_cover_url","imgs","normalImgs"
"R2T04UMZPYPW3M","Birthday gift ","https://www.amazon.com/gp/profile/amzn1.account.AFV2BAGVMXUR2ZANNEEPV5G5FZWA/ref=cm_cr_arp_d_gw_btm?ie=UTF8","4","","https://www.amazon.com/gp/customer-reviews/R2T04UMZPYPW3M/ref=cm_cr_arp_d_rvw_ttl?ie=UTF8&ASIN=B09WZBPX7K","B09WZBPX7K","Ring camera has great quality and motion detection. The only down side is having to unscrew and replace the battery every 6-7 days with the recommended motion settings (low usage of battery). I would recommend getting the solar attachment with it. Be sure to check the sizing of the ring camera before purchasing, for our side paneling, the ring camera can only fit sideways (lol), but it does what it need to do-- capture any motion triggered.","Reviewed in the United States on May 10, 2024","Configuration: Doorbell only","Verified Purchase","2 people found this helpful","","","[]","[]"
"R2JSNPNUUFRWYV","Mimzy","https://www.amazon.com/gp/profile/amzn1.account.AFNG5A6ZKT7NBSIRBLZR5XM5BXLQ/ref=cm_cr_arp_d_gw_btm?ie=UTF8","5","","https://www.amazon.com/gp/customer-reviews/R2JSNPNUUFRWYV/ref=cm_cr_arp_d_rvw_ttl?ie=UTF8&ASIN=B09WZBPX7K","B09WZBPX7K","I live in an apartment, so I can't exactly get a Ring doorbell hardwired into the place. I didn't even have to screw this into the doorframe - Ring offers an accessory that allows you to stick the doorbell to the frame with a strong adhesive! Just make sure that you get one for the right model (totally not speaking from experience here lol)<br>I only have to charge the battery about once a month, and even then you can buy another battery so that you don't have to go several hours without coverage.<br>I feel so much safer having a camera on my door. I do have to pay for a monthly Ring subscription to keep my videos, but I think it's more than worth it. I also have a stick up camera and the alarm system inside and they've been great so far.<br><br>It's the little things I love about Ring, like being able to check the camera from the safety of my bed when I hear a noise outside or checking in on my place when I'm out of town.","Reviewed in the United States on April 12, 2024","Configuration: Doorbell only","Verified Purchase","2 people found this helpful","","","[]","[]"
"R28GDQM2YVXRMG","Bluesugah","https://www.amazon.com/gp/profile/amzn1.account.AETLOFVCY5VYBUI5WIXGFLDLGG2A/ref=cm_cr_arp_d_gw_btm?ie=UTF8","5","","https://www.amazon.com/gp/customer-reviews/R28GDQM2YVXRMG/ref=cm_cr_arp_d_rvw_ttl?ie=UTF8&ASIN=B09WZBPX7K","B09WZBPX7K","I use this product for when I'm at the far end of the house. I don't hear someone knocking","Reviewed in the United States on June 28, 2024","Configuration: Doorbell only","Verified Purchase","","","","[]","[]"
"R3AQND8UBPKVQK","Julia Williams","https://www.amazon.com/gp/profile/amzn1.account.AELKCUN7FI2Y6C72FAVTZAXTPCOA/ref=cm_cr_arp_d_gw_btm?ie=UTF8","5","","https://www.amazon.com/gp/customer-reviews/R3AQND8UBPKVQK/ref=cm_cr_arp_d_rvw_ttl?ie=UTF8&ASIN=B09WZBPX7K","B09WZBPX7K","Love it. Need this. Some people are intrusive and like to take from other people's yards. Not with this thing. Caught ya....😏","Reviewed in the United States on June 24, 2024","Configuration: Doorbell only","Verified Purchase","","","","[]","[]"
"R2XNM6VICODHHP","JoseColon","https://www.amazon.com/gp/profile/amzn1.account.AENUGSJ5QTNDYPXIFJ3MWM7T7HQQ/ref=cm_cr_arp_d_gw_btm?ie=UTF8","5","","https://www.amazon.com/gp/customer-reviews/R2XNM6VICODHHP/ref=cm_cr_arp_d_rvw_ttl?ie=UTF8&ASIN=B09WZBPX7K","B09WZBPX7K","Great resolution and response, and even support personnel is great!","Reviewed in the United States on July 2, 2024","Configuration: Doorbell only","Verified Purchase","","","","[]","[]"
"R10AC6XV3CSO1Y","Adriana Jaimes","https://www.amazon.com/gp/profile/amzn1.account.AELUOIS76RVYQJXJ53RUPNA5Q6HQ/ref=cm_cr_arp_d_gw_btm?ie=UTF8","5","","https://www.amazon.com/gp/customer-reviews/R10AC6XV3CSO1Y/ref=cm_cr_arp_d_rvw_ttl?ie=UTF8&ASIN=B09WZBPX7K","B09WZBPX7K","Works well just takes time to connect to WiFi sometimes","Reviewed in the United States on July 3, 2024","Configuration: Doorbell only","Verified Purchase","","","","[]","[]"
"R1XKWTQNIRQKDB","Leigh","https://www.amazon.com/gp/profile/amzn1.account.AFPSX7SLMDIA4ZUHARTYHLHNBBQA/ref=cm_cr_arp_d_gw_btm?ie=UTF8","4","","https://www.amazon.com/gp/customer-reviews/R1XKWTQNIRQKDB/ref=cm_cr_arp_d_rvw_ttl?ie=UTF8&ASIN=B09WZBPX7K","B09WZBPX7K","This is installed on a west facing wall and every afternoon I receive 1 or 2 false notifications. My guess is the sun effects the sensor. I have had 2 package deliveries to date where the camera did not capture the activity.","Reviewed in the United States on June 1, 2024","Configuration: Doorbell only","Verified Purchase","2 people found this helpful","","","[]","[]"
"R1YAUPWWU74NVR","Sharon","https://www.amazon.com/gp/profile/amzn1.account.AE7DW36R7ANAHG73VT4FI3W562TQ/ref=cm_cr_arp_d_gw_btm?ie=UTF8","5","","https://www.amazon.com/gp/customer-reviews/R1YAUPWWU74NVR/ref=cm_cr_arp_d_rvw_ttl?ie=UTF8&ASIN=B09WZBPX7K","B09WZBPX7K","I had to buy the plug in chimes but works great. Night vision and motion detection good.","Reviewed in the United States on June 24, 2024","Configuration: Doorbell only","Verified Purchase","","","","[]","[]"
"R2FNVFZJDGBVNA","Seta M.","https://www.amazon.com/gp/profile/amzn1.account.AH4G3U26DBOWKFRNB5INLQ5ML7ZQ/ref=cm_cr_arp_d_gw_btm?ie=UTF8","5","","https://www.amazon.com/gp/customer-reviews/R2FNVFZJDGBVNA/ref=cm_cr_arp_d_rvw_ttl?ie=UTF8&ASIN=B09WZBPX7K","B09WZBPX7K","There is nothing I don’t like about this unit and I’m planning on getting another one soon!","Reviewed in the United States on June 23, 2024","Configuration: Doorbell only","Verified Purchase","","","","[]","[]"
"R18NEND9WD4BC0","Alma E. Lamberson","https://www.amazon.com/gp/profile/amzn1.account.AEDHLVBDP7HEF4PIBO7MXCUEX7VA/ref=cm_cr_arp_d_gw_btm?ie=UTF8","5","","https://www.amazon.com/gp/customer-reviews/R18NEND9WD4BC0/ref=cm_cr_arp_d_rvw_ttl?ie=UTF8&ASIN=B09WZBPX7K","B09WZBPX7K","This is my second ring doorbell !have been very good.","Reviewed in the United States on June 29, 2024","Configuration: Doorbell only","Verified Purchase","","","","[]","[]"
"RUJ4TVRH91L68","Marquita Robinson","https://www.amazon.com/gp/profile/amzn1.account.AHCWMS7ANOSWAOJLCWHA54OJ5OFA/ref=cm_cr_arp_d_gw_btm?ie=UTF8","5","","https://www.amazon.com/gp/customer-reviews/RUJ4TVRH91L68/ref=cm_cr_arp_d_rvw_ttl?ie=UTF8&ASIN=B09WZBPX7K","B09WZBPX7K","I like being able to see head to toe, also the color vision at night is phenomenal, it allows me to better distinguish people, objects and faces. It's so clear and very responsive.","Reviewed in the United States on June 11, 2024","Configuration: Doorbell only","Verified Purchase","4 people found this helpful","","","[]","[]"
"R23XDEVSYN4BVA","Margaret Stoll","https://www.amazon.com/gp/profile/amzn1.account.AGKHAAV66ECQEADMEOL2NWEFB4WA/ref=cm_cr_arp_d_gw_btm?ie=UTF8","5","","https://www.amazon.com/gp/customer-reviews/R23XDEVSYN4BVA/ref=cm_cr_arp_d_rvw_ttl?ie=UTF8&ASIN=B09WZBPX7K","B09WZBPX7K","I’ve tried a couple other doorbell cameras, but this one works the best. Especially since we have an older home, so the wireless option is great!","Reviewed in the United States on June 18, 2024","Configuration: Doorbell only","Verified Purchase","","","","[]","[]"
"R2AN8RZ6QUT2S2","Amazon fan","https://www.amazon.com/gp/profile/amzn1.account.AFFAVGFRD4RXDH7RW2NH6KJC43IA/ref=cm_cr_arp_d_gw_btm?ie=UTF8","5","","https://www.amazon.com/gp/customer-reviews/R2AN8RZ6QUT2S2/ref=cm_cr_arp_d_rvw_ttl?ie=UTF8&ASIN=B09WZBPX7K","B09WZBPX7K","I had Ring Doorbell Pro about 5 years ago. The Ring button started to disintegrate and it didn't respond anymore. Therefore, I decided to buy a Ring Doorbell 4 for replacement as the price is more resonable. Well, it turned out that the night vision was too dark and the color was distorted. The wifi connection was very poor. But then I found out that Ring Doorbell Plus performs much better than Ring Doorbell 4, so I decided to return Ring Doorbell 4 and bought Ring Doorbell Plus. The result is day and night.<br>The video is clear. Night vision is bright and clear. No distortion. The wifi connection is great.<br>Comparing with the latest Ring Doorbell Pro which is over $200, The price friendly Ring Doorbell Plus is an excellent choice.","Reviewed in the United States on April 24, 2024","Configuration: Doorbell only","Verified Purchase","One person found this helpful","","","[]","[]"
"R1ZWJK7WTJYDST","lizbeth guerrero","https://www.amazon.com/gp/profile/amzn1.account.AESUQSHDLALERZAOY5GNDNKKJ5MQ/ref=cm_cr_arp_d_gw_btm?ie=UTF8","4","","https://www.amazon.com/gp/customer-reviews/R1ZWJK7WTJYDST/ref=cm_cr_arp_d_rvw_ttl?ie=UTF8&ASIN=B09WZBPX7K","B09WZBPX7K","Would be 5 stars if it didn’t skip a lot I’m afraid it will miss a big event skip right through it whenever I really do need it","Reviewed in the United States on June 12, 2024","Configuration: Doorbell only","Verified Purchase","","","","[]","[]"
"R3QH72MWC4PADK","brenda burrows","https://www.amazon.com/gp/profile/amzn1.account.AHFYVE65SPTFGO63MTPXGFOFQMZA/ref=cm_cr_arp_d_gw_btm?ie=UTF8","5","","https://www.amazon.com/gp/customer-reviews/R3QH72MWC4PADK/ref=cm_cr_arp_d_rvw_ttl?ie=UTF8&ASIN=B09WZBPX7K","B09WZBPX7K","Love this product…<br>I accidentally turned on my small speaker to find the connectivity is on! Who knew!<br>The sound is louder than my phone!","Reviewed in the United States on June 13, 2024","Configuration: Doorbell only","Verified Purchase","","","","[]","[]"
"RBF5OZOGAHTAB","Paige","https://www.amazon.com/gp/profile/amzn1.account.AEVNUCAV5YT5IVH7LYKYW7NE5JQA/ref=cm_cr_arp_d_gw_btm?ie=UTF8","5","","https://www.amazon.com/gp/customer-reviews/RBF5OZOGAHTAB/ref=cm_cr_arp_d_rvw_ttl?ie=UTF8&ASIN=B09WZBPX7K","B09WZBPX7K","Should've taken a picture to go with the review, but we love it so far! Easy setup, easy installation. Picture quality/sound &amp; recording is all 10/10 for us.","Reviewed in the United States on June 12, 2024","Configuration: Doorbell only","Verified Purchase","","","","[]","[]"
"RHN2X0O199I85","Janell&amp;Anthony C.","https://www.amazon.com/gp/profile/amzn1.account.AEHGUL6ZWYUK6W6UNXWB3SAML2HQ/ref=cm_cr_arp_d_gw_btm?ie=UTF8","4","","https://www.amazon.com/gp/customer-reviews/RHN2X0O199I85/ref=cm_cr_arp_d_rvw_ttl?ie=UTF8&ASIN=B09WZBPX7K","B09WZBPX7K","Works well.haveing issues with blueness of cam tho. Can't connect to app but works threw Alexa quite well. Only thing ide like it to do is keep the cam up instead of shutting off after 2 minutes or so.","Reviewed in the United States on June 8, 2024","Configuration: Doorbell only","Verified Purchase","","","","[]","[]"
"RL5FNO6ODVLXP","sarah","https://www.amazon.com/gp/profile/amzn1.account.AGBLD7MTL6JX5CLYT5HJD7NQV3BA/ref=cm_cr_arp_d_gw_btm?ie=UTF8","3","","https://www.amazon.com/gp/customer-reviews/RL5FNO6ODVLXP/ref=cm_cr_arp_d_rvw_ttl?ie=UTF8&ASIN=B09WZBPX7K","B09WZBPX7K","Easy to set up and install.<br><br>As for motion it doesn't  always seem to pick up that someone is coming or going from my door. As the battery drains, the worse it gets. I have this set up on my side door.  It will only pick up and alert us to motion from my door 7 out of 10 times, if that. I will keep playing with the zones, maybe that is it. I have it set now that it won't pick up people walking up and down the street on the right side and have it set so it won't pick up my neighbors enjoying their backyards on the left side, which it did pick up a first until I had adjusted the zones. I work from home and have a parent with dementia. If it's a nice day he likes to go outside. He purposely wanders at this time and wanted something for when the time comes when he aimlessly wanders.  We'll have to figure out what to do with our doors, but this would be a good backup in case he happens to get out the door(if it picks up his motion lol) so we can see which way he went.<br><br>I did buy the stick up cam also for the backyard to pick up where doorbell view ends, but have not set that up yet. So hopefully this cam will pick up motion that the doorbell did not. *crosses fingers*<br><br>It does not pick up or alert to any cars pulling into the driveway.<br><br>Picture quality at night is pretty good, but it has not alerted me at all during the night of any motion. Which I find odd as there's lots of animals that come out and wander at night. I haven't noticed any pawprints or hoofprints so maybe they haven't come around in front of the camera, but I doubt it.<br><br>I will keep this as I got it on sale, but I would not buy another one for the front door at full price. It doesn't seem worth it","Reviewed in the United States on May 3, 2024","Configuration: Doorbell only","Verified Purchase","3 people found this helpful","","","[]","[]"
"R11BNZFNWMMO3S","Grish","https://www.amazon.com/gp/profile/amzn1.account.AERYCVAAHBIRMO2LNB7GQAW7VXQQ/ref=cm_cr_arp_d_gw_btm?ie=UTF8","4","","https://www.amazon.com/gp/customer-reviews/R11BNZFNWMMO3S/ref=cm_cr_arp_d_rvw_ttl?ie=UTF8&ASIN=B09WZBPX7K","B09WZBPX7K","I absolutely love my Ring Doorbell.  I do think the cost for Protection Plans are a little excessive.","Reviewed in the United States on June 11, 2024","Configuration: Doorbell only","Verified Purchase","","","","[]","[]"
"R33JR31FGB67NX","Dawn B","https://www.amazon.com/gp/profile/amzn1.account.AECOOYXHFTURQXFYEPQH555THVOQ/ref=cm_cr_arp_d_gw_btm?ie=UTF8","5","","https://www.amazon.com/gp/customer-reviews/R33JR31FGB67NX/ref=cm_cr_arp_d_rvw_ttl?ie=UTF8&ASIN=B09WZBPX7K","B09WZBPX7K","Love the birdseye view. Thats new","Reviewed in the United States on July 3, 2024","Configuration: Doorbell only","Verified Purchase","","","","[]","[]"
"R2DG4VYHZ264RO","sheila Compton ","https://www.amazon.com/gp/profile/amzn1.account.AH6JRUA4RACGHWLCFRE4W37M4I3Q/ref=cm_cr_arp_d_gw_btm?ie=UTF8","5","","https://www.amazon.com/gp/customer-reviews/R2DG4VYHZ264RO/ref=cm_cr_arp_d_rvw_ttl?ie=UTF8&ASIN=B09WZBPX7K","B09WZBPX7K","I’m so happy with my ring doorbell!! All the things that were happening before I got it, are no longer happening. I feel safe now.","Reviewed in the United States on June 19, 2024","Configuration: Doorbell only","Verified Purchase","","","","[]","[]"
"R36AG1NQ317GOW","Jay R.","https://www.amazon.com/gp/profile/amzn1.account.AETUJZXKFNYG375PPJ65CIW2ATNQ/ref=cm_cr_arp_d_gw_btm?ie=UTF8","4","","https://www.amazon.com/gp/customer-reviews/R36AG1NQ317GOW/ref=cm_cr_arp_d_rvw_ttl?ie=UTF8&ASIN=B09WZBPX7K","B09WZBPX7K","I had the lower-cost Ring Doorbell for about a year now, and the one thing I hated the most about it was that to charge the battery, you had to remove THE ENTIRE DOORBELL. I had to remove the doorbell once a month... until lately when something started causing the doorbell to drain to 0-percent in about 7-8 days. This is not good and such a hassle to have to recharge the doorbell when charging time takes hours! I thought at first that with the optional ""hardwired kit"" it this wouldn't be a problem, but the hardwire kit isn't even to power the unit at all - it only trickle charges it! So if your doorbell is using more power than the trickle charge can put back in, then it's pointless.<br><br>I dealt with that for about a month more until Amazon had their Prime Deals event, and when I saw that the more expensive Ring Battery Doorbell Plus was on sale, I bought it.<br><br>So here I am with a newer, more expensive, higher model Ring Battery Doorbell Plus. The mounting holes for the Ring Battery Doorbell Plus are different from the Ring Doorbell, I don't know why they couldn't keep something standard but apparently, all of the various doorbell versions have their own different mounting pattern. Once I got past this hurdle, the rest of the installation was easy and quick.<br><br>With the new Ring Battery Doorbell Plus, I immediately gained two good features: first, the camera view was much taller, they were serious when they said it has a ""floor to ceiling"" view as I can see much more with the newer doorbell - great for when I have deliveries. Second: the removable battery just fixes the biggest flaw of my original Ring Doorbell. I bought a second battery just in case after having such a bad time with the original doorbell, but it seems like the Battery Doorbell Plus is much more efficient with the power, as I have had it installed for a couple of months now and the lowest I saw the battery dip down to was 87%. Picture quality is very good throughout the day, even in the evening with the porch lamp on I can see visitor faces clearly and not blown out like other cameras.<br><br>So if you're looking for your first Ring doorbell, do not get the cheapest $50 version - do yourself a favor and go right to the Battery Doorbell Plus, it is worth the higher price and you don't have to deal with the shortcomings of the cheaper, basic version","Reviewed in the United States on October 31, 2023","Configuration: Doorbell only","Verified Purchase","436 people found this helpful","","","[]","[]"
"RA3FI9G95KUOW","Amazon Customer","https://www.amazon.com/gp/profile/amzn1.account.AHQLJZZZSAI65LHDVUM6NQSDYPXA/ref=cm_cr_arp_d_gw_btm?ie=UTF8","5","","https://www.amazon.com/gp/customer-reviews/RA3FI9G95KUOW/ref=cm_cr_arp_d_rvw_ttl?ie=UTF8&ASIN=B09WZBPX7K","B09WZBPX7K","I'm highly impressed with the ease of installation and the overall quality of the video. I opted not to hard wire it to my existing doorbell but rather use the included internal battery. I used Velcro to attach the camera to my storm door. Once you have it installed,go into your settings on the app and turn on HDR video and night vision. This gives you a color video picture.<br>Each time someone approaches my door,I get a motion alert even before they push the doorbell button on the camera.<br>I definitely recommend this product.","Reviewed in the United States on May 24, 2024","Configuration: Doorbell only","Verified Purchase","23 people found this helpful","","","[""https://m.media-amazon.com/images/I/81jRybaaKSL._SY88.jpg""]","[""https://m.media-amazon.com/images/I/81jRybaaKSL.jpg""]"
"R21A12PF5AGY31","Mike Harsha","https://www.amazon.com/gp/profile/amzn1.account.AHDU5IWB6UYUGR755SPMJOELRY6Q/ref=cm_cr_arp_d_gw_btm?ie=UTF8","3","","https://www.amazon.com/gp/customer-reviews/R21A12PF5AGY31/ref=cm_cr_arp_d_rvw_ttl?ie=UTF8&ASIN=B09WZBPX7K","B09WZBPX7K","I have had this unit for approx. 4 months now and have a few comments. When the unit works it is really good, but it simply stops working sometimes and why that happens is a mystery to me and Ring is no help. Here are a couple of the issue I have.<br><br>1. It seems to work fine for 24 hours and then it will stop sending notifications to my Samsung phone. I have to reboot the phone to get the notifications once again.<br>2.  Most days it does not exhibit any noticeable lag between detection and notification, but sometimes the lag can be up to 90 seconds. Nothing would have changed regarding orientation to the modem receiving the signal yet the lag is there.<br>3.  The almost worthless little instruction manual that comes with the product clearly states ""Download the full manual online."". Yet the manual for this product is nowhere to be found online and when I finally chatted with customer service they informed me that a downloadable manual does not exist yet. I am not sure if that was trying to tell me that one would be forthcoming or just forget it pal, you get no manual. I was furnished with a Youtube link that had many informative videos, could have found that myself.<br><br>If I could figure out the little annoyances detailed above I would give it a higher rating. If it worked it would be ideal for my apartment, porch pirates are an issue in this area.","Reviewed in the United States on May 26, 2024","Configuration: Doorbell only","Verified Purchase","3 people found this helpful","","","[]","[]"
"R2J6KERP6K2BU8","Diane Biggs","https://www.amazon.com/gp/profile/amzn1.account.AFWZFXT5KW75EGAEOPDJNPY6FISQ/ref=cm_cr_arp_d_gw_btm?ie=UTF8","4","","https://www.amazon.com/gp/customer-reviews/R2J6KERP6K2BU8/ref=cm_cr_arp_d_rvw_ttl?ie=UTF8&ASIN=B09WZBPX7K","B09WZBPX7K","I like it because it notifies me if someone is in my driveway and or @ my front door.  Feel safer!!","Reviewed in the United States on May 29, 2024","Configuration: Doorbell only","Verified Purchase","One person found this helpful","","","[]","[]"
"R3T3CJDYPEBWQC","Judy B. Rams fan","https://www.amazon.com/gp/profile/amzn1.account.AGOXKXEQBP5ZC7CBDYG25QRJKWFQ/ref=cm_cr_arp_d_gw_btm?ie=UTF8","4","","https://www.amazon.com/gp/customer-reviews/R3T3CJDYPEBWQC/ref=cm_cr_arp_d_rvw_ttl?ie=UTF8&ASIN=B09WZBPX7K","B09WZBPX7K","Works great very clear video. The only thing is for your videos to be saved.You do have to pay a subscription fee","Reviewed in the United States on May 23, 2024","Configuration: Doorbell only","Verified Purchase","","","","[]","[]"
"R9AEX2Z0A33AI","L. Fox","https://www.amazon.com/gp/profile/amzn1.account.AGSMRFBZSEB4GGAOOIQ5XSCSBB7A/ref=cm_cr_arp_d_gw_btm?ie=UTF8","5","","https://www.amazon.com/gp/customer-reviews/R9AEX2Z0A33AI/ref=cm_cr_arp_d_rvw_ttl?ie=UTF8&ASIN=B09WZBPX7K","B09WZBPX7K","Much better upgrade than the old Ring 2 I had. Love the picture and removable battery.","Reviewed in the United States on June 17, 2024","Configuration: Doorbell only","Verified Purchase","","","","[]","[]"
"R18WG8ZNK436T6","Shyane","https://www.amazon.com/gp/profile/amzn1.account.AGXDU7VIDUWJHGVY3NDIO3QGWYHQ/ref=cm_cr_arp_d_gw_btm?ie=UTF8","5","","https://www.amazon.com/gp/customer-reviews/R18WG8ZNK436T6/ref=cm_cr_arp_d_rvw_ttl?ie=UTF8&ASIN=B09WZBPX7K","B09WZBPX7K","Easy to use love the video quality and brings me the peace of mind when it come to watching over my car and home definitely worth it’s money","Reviewed in the United States on June 11, 2024","Configuration: Doorbell only","Verified Purchase","","","","[]","[]"
"R3CNYPLAI67NAG","Pat M.","https://www.amazon.com/gp/profile/amzn1.account.AEMRBSBJL6TK3DG5FSVRFVPU4RWA/ref=cm_cr_arp_d_gw_btm?ie=UTF8","5","","https://www.amazon.com/gp/customer-reviews/R3CNYPLAI67NAG/ref=cm_cr_arp_d_rvw_ttl?ie=UTF8&ASIN=B09WZBPX7K","B09WZBPX7K","Easy to install and set up. Everything we wanted from a video doorbell. Night vision is good as well.","Reviewed in the United States on June 9, 2024","Configuration: Doorbell only","Verified Purchase","","","","[]","[]"
"R2A2NHJJOQ8GYL","Nicole S","https://www.amazon.com/gp/profile/amzn1.account.AFHW2D3J6F5AIIKG623EIG46MOKQ/ref=cm_cr_arp_d_gw_btm?ie=UTF8","4","","https://www.amazon.com/gp/customer-reviews/R2A2NHJJOQ8GYL/ref=cm_cr_arp_d_rvw_ttl?ie=UTF8&ASIN=B09WZBPX7K","B09WZBPX7K","We’ve used Ring for many many years and love their products! We just purchased the new “Battery Doorbell Plus” when our OG decided to go kaput. i’m sure eight years of Iowa winters had something to do with the life expectancy of our original product.<br>If you’re going to use the rechargeable battery option, instructions are straightforward and it’s very simple to install and use. However, if you are going to hardwire your doorbell to run through an existing house doorbell system, the sticker on the back denotes DC power when it is indeed AC power.<br>**We found the correct instructions on the Ring website.<br>Good thing I am married to a part-time electrician!","Reviewed in the United States on March 30, 2024","Configuration: Doorbell only","Verified Purchase","2 people found this helpful","","","[]","[]"
"R1QX8MELF8NUEB","cindy","https://www.amazon.com/gp/profile/amzn1.account.AEG3GFTLUV5QF6JYUEQNXG2ON2IQ/ref=cm_cr_arp_d_gw_btm?ie=UTF8","4","","https://www.amazon.com/gp/customer-reviews/R1QX8MELF8NUEB/ref=cm_cr_arp_d_rvw_ttl?ie=UTF8&ASIN=B09WZBPX7K","B09WZBPX7K","it does works fine. after you figure it out! The directions to install were super easy. The learning was getting the app on phone ( i did not have a doorbell prior, so was trying for the ring to go to phone) that did work great...but i also needed sound when phones were not home. so bought the ring accessory to. You should know that both run on WiFi. then I had to learn where and how to set perimeters for detection etc. this is not difficult to figure out, but you will need more than a few minutes to look thru the options for bells and motion and so on. for example, the city bus set my Ring off every time it went by until i changed the zone.<br>i do like it and do recommend it.","Reviewed in the United States on March 23, 2024","Configuration: Doorbell only","Verified Purchase","","","","[]","[]"
"R1H24K5SVCUXZ8","The James Family","https://www.amazon.com/gp/profile/amzn1.account.AFWH2PNO3IE7KJQEFMOBZCWAJZ6A/ref=cm_cr_arp_d_gw_btm?ie=UTF8","5","","https://www.amazon.com/gp/customer-reviews/R1H24K5SVCUXZ8/ref=cm_cr_arp_d_rvw_ttl?ie=UTF8&ASIN=B09WZBPX7K","B09WZBPX7K","Once he got this installed, he loved it. It’s all he is talking about.","Reviewed in the United States on June 15, 2024","Configuration: Doorbell only","Verified Purchase","","","","[]","[]"
"RQJI3HBK2VAGJ","Mario","https://www.amazon.com/gp/profile/amzn1.account.AGWL46OT4BYL25ASCTTJNSUGXDQA/ref=cm_cr_arp_d_gw_btm?ie=UTF8","5","","https://www.amazon.com/gp/customer-reviews/RQJI3HBK2VAGJ/ref=cm_cr_arp_d_rvw_ttl?ie=UTF8&ASIN=B09WZBPX7K","B09WZBPX7K","Took some trial and error to set up zones due to my awkward front door, but works perfectly now. Picture is very clear and alerts are prompt","Reviewed in the United States on June 4, 2024","Configuration: Doorbell only","Verified Purchase","","","","[]","[]"
