"id","username","profileURL","rating","title","review_url","asin","content","date","format_strip","verified","helpful","videoURL","video_cover_url","imgs","normalImgs"
"R3J6EQ0KOKUKQT","C","https://www.amazon.com/gp/profile/amzn1.account.AF2PEUAK6FW32DCR2AEMGDQ7SJYQ/ref=cm_cr_arp_d_gw_btm?ie=UTF8","5","","https://www.amazon.com/gp/customer-reviews/R3J6EQ0KOKUKQT/ref=cm_cr_arp_d_rvw_ttl?ie=UTF8&ASIN=B09WZBPX7K","B09WZBPX7K","I just received it yesterday &amp; it works great. Easy to set up. Should’ve gotten one sooner. The case that is on it I purchased seperately.","Reviewed in the United States on June 7, 2024","Configuration: Doorbell only","Verified Purchase","3 people found this helpful","","","[""https://m.media-amazon.com/images/I/71GEG9KX9aL._SY88.jpg""]","[""https://m.media-amazon.com/images/I/71GEG9KX9aL.jpg""]"
"R34SLUXC69K18P","Megan Siebert","https://www.amazon.com/gp/profile/amzn1.account.AG54RSQSN6I5ASKDGY7OZBEP6PKA/ref=cm_cr_arp_d_gw_btm?ie=UTF8","4","","https://www.amazon.com/gp/customer-reviews/R34SLUXC69K18P/ref=cm_cr_arp_d_rvw_ttl?ie=UTF8&ASIN=B09WZBPX7K","B09WZBPX7K","Can’t figure out how to hang this. So annoyed. And ring is super hard to contact for support.<br><br>So, I am amending my original review because after that Ring went above and beyond to help me install my upgraded doorbell. Link reached out to me and walked me through what I needed to do and supplied video support. As frustrating as the process was the upgraded doorbell is really worth it. I can get all angles of my front step and the camera quality is so much better. So thank you for the follow through to the Ring customer service team.","Reviewed in the United States on April 13, 2024","Configuration: Doorbell only","Verified Purchase","","","","[]","[]"
"R1C3YBAMUH8H11","Mabelm","https://www.amazon.com/gp/profile/amzn1.account.AE5JR6GW5NRERKMTMFPJ65OKHGDA/ref=cm_cr_arp_d_gw_btm?ie=UTF8","5","","https://www.amazon.com/gp/customer-reviews/R1C3YBAMUH8H11/ref=cm_cr_arp_d_rvw_ttl?ie=UTF8&ASIN=B09WZBPX7K","B09WZBPX7K","Necesario para las personas q necesitan privacidad","Reviewed in the United States on June 19, 2024","Configuration: Doorbell only","Verified Purchase","","","","[]","[]"
"R1LZD0ML902VTB","Tt","https://www.amazon.com/gp/profile/amzn1.account.AGZQDOIBDXWFJJK5NIYROKV3DGKA/ref=cm_cr_arp_d_gw_btm?ie=UTF8","5","","https://www.amazon.com/gp/customer-reviews/R1LZD0ML902VTB/ref=cm_cr_arp_d_rvw_ttl?ie=UTF8&ASIN=B09WZBPX7K","B09WZBPX7K","Great video doorbell","Reviewed in the United States on June 20, 2024","Configuration: Doorbell only","Verified Purchase","","","","[]","[]"
"R2JLBSK4DIEQXH","Alex","https://www.amazon.com/gp/profile/amzn1.account.AHSCGEQKI6XFK5VZUD52RFDRTITA/ref=cm_cr_arp_d_gw_btm?ie=UTF8","5","","https://www.amazon.com/gp/customer-reviews/R2JLBSK4DIEQXH/ref=cm_cr_arp_d_rvw_ttl?ie=UTF8&ASIN=B09WZBPX7K","B09WZBPX7K","Bought this after seeing my brother's regular ring camera.  After some research, this seemed to be the best value for the money.  I can see my top step now and get alerts when packages are left near my door.  Happy with how it works and probably will buy a second one for my backdoor later on.  My one complaint is that it would be nice to turn off the cloud integration and self-host this locally only, but this isn't the product for that.","Reviewed in the United States on May 8, 2024","Configuration: Doorbell only","Verified Purchase","","","","[]","[]"
"R24X6XKCRBKO7F","Calvin Gentry","https://www.amazon.com/gp/profile/amzn1.account.AFJTKQP7WSUFYE37NYSZC6GLFMWQ/ref=cm_cr_arp_d_gw_btm?ie=UTF8","5","","https://www.amazon.com/gp/customer-reviews/R24X6XKCRBKO7F/ref=cm_cr_arp_d_rvw_ttl?ie=UTF8&ASIN=B09WZBPX7K","B09WZBPX7K","This security camera works well.","Reviewed in the United States on June 24, 2024","Configuration: Doorbell only","Verified Purchase","","","","[]","[]"
"R23UNSZP3PAMJF","Greg S","https://www.amazon.com/gp/profile/amzn1.account.AGM6B54HES66WS32MF3HFMFCGQZQ/ref=cm_cr_arp_d_gw_btm?ie=UTF8","4","","https://www.amazon.com/gp/customer-reviews/R23UNSZP3PAMJF/ref=cm_cr_arp_d_rvw_ttl?ie=UTF8&ASIN=B09WZBPX7K","B09WZBPX7K","I purchased this on a holiday season special to replace a 4 year old previous model.  my old ring was set up using battery only - because I live in a townhouse where the build in doorbell is mounted on a side wall facing wrong direction.  I managed with the old ring charging it about every 8 weeks.  When I got the new Ring doorbell plus, I originally thought the battery life was going to be problem and was unable to really turn on all of the features because every time the app would warn me about battery life and it already seemed not as good as the older ring.<br><br>So to solve this, I kept the new ring and found a way to run a wire from my old doorbell button to the spot where the ring is mounted and replaced the doorbell transformer with one that meets Ring's power source specs.  Once the device is hardwired - it runs on battery but trickle charges to keep it at or close to 100% charge.  Now I was able to increase snapshot capture, motion detection and fully take advantage of this model.  The motion and package detection work well and the camera is a nice improvement over the previous model from 4 years ago that I replaced.<br><br>Overall 5 stars if you have a power source.  If you don' t have a power source and rely on battery, your results may vary.","Reviewed in the United States on January 10, 2024","Configuration: Doorbell only","Verified Purchase","7 people found this helpful","","","[]","[]"
"R2ZKC858OGW7JZ","CeCe M","https://www.amazon.com/gp/profile/amzn1.account.AGTK2BL3XGAGSODGAQRH6DHHPFVQ/ref=cm_cr_arp_d_gw_btm?ie=UTF8","4","","https://www.amazon.com/gp/customer-reviews/R2ZKC858OGW7JZ/ref=cm_cr_arp_d_rvw_ttl?ie=UTF8&ASIN=B09WZBPX7K","B09WZBPX7K","This ring battery doorbell is a big improvement over the one I've had since Ring first became a company, the camera clarity is very clear and finally I can see a head to toe picture, I didn't give it 5 stars because this doorbell I purchased was supposed to be new and there were scratches on the face of the camera like it had been a used, I didn't bother returning because I had installed it and peeled off the plastic and then the scratches were noticable so before you install be sure to inspect what you bought before installing since they do sell gently used products, I just wish I didn't pay for a new doorbell when I clearly got a used one","Reviewed in the United States on March 26, 2024","Configuration: Doorbell only","Verified Purchase","","","","[]","[]"
"R2BVKEB4D63Q1G","Paul B.","https://www.amazon.com/gp/profile/amzn1.account.AEXAHPBJPTWCKVP2HAQOS6UJPREQ/ref=cm_cr_arp_d_gw_btm?ie=UTF8","5","","https://www.amazon.com/gp/customer-reviews/R2BVKEB4D63Q1G/ref=cm_cr_arp_d_rvw_ttl?ie=UTF8&ASIN=B09WZBPX7K","B09WZBPX7K","Cannot compare to other sorts of units, but this one works quite well.  A wizz to install (on battery power), and a pile of features which menu on your phone.  One can buy additional eyes.<br><br>Believe that the woman who was investigated by federal agents had a system with an additional eye.  And were her  ""barking dogs"" real or a Ring feature?  (I have that feature silenced.)<br><br>Noticed, recently, that my two across street neighbors have installed Ring units.  Guess they saw the same ""visit"" on YouTube.","Reviewed in the United States on April 29, 2024","Configuration: Doorbell only","Verified Purchase","One person found this helpful","","","[]","[]"
"R17A4580VL2UQT","Jhonatan","https://www.amazon.com/gp/profile/amzn1.account.AHVOZPATCOS5GLHNRLU57KA5PYGA/ref=cm_cr_arp_d_gw_btm?ie=UTF8","5","","https://www.amazon.com/gp/customer-reviews/R17A4580VL2UQT/ref=cm_cr_arp_d_rvw_ttl?ie=UTF8&ASIN=B09WZBPX7K","B09WZBPX7K","Great camera worth the price. The charge is very quick too. The sound quality is okay. It connects quick tooZ the image quality and performance is great as well.","Reviewed in the United States on June 2, 2024","Configuration: Doorbell only","Verified Purchase","3 people found this helpful","","","[]","[]"
"RHZ8JETZPS8AZ","Estela Reyes.","https://www.amazon.com/gp/profile/amzn1.account.AHU3MIAAXLJEXB23X3OOTORAVSXQ/ref=cm_cr_arp_d_gw_btm?ie=UTF8","5","","https://www.amazon.com/gp/customer-reviews/RHZ8JETZPS8AZ/ref=cm_cr_arp_d_rvw_ttl?ie=UTF8&ASIN=B09WZBPX7K","B09WZBPX7K","My older was not good,  so we replace and it's much better view","Reviewed in the United States on May 23, 2024","Configuration: Doorbell only","Verified Purchase","","","","[]","[]"
"R11SIMFEE8GTVF","Alfonso Maxwell","https://www.amazon.com/gp/profile/amzn1.account.AESAUC67N6IM2NT34BL7QPE4MP2Q/ref=cm_cr_arp_d_gw_btm?ie=UTF8","5","","https://www.amazon.com/gp/customer-reviews/R11SIMFEE8GTVF/ref=cm_cr_arp_d_rvw_ttl?ie=UTF8&ASIN=B09WZBPX7K","B09WZBPX7K","Yup...Works Good","Reviewed in the United States on June 15, 2024","Configuration: Doorbell only","Verified Purchase","","","","[]","[]"
"R3Q2V4Y3AUSUU9","LisaDeeBumbleBee","https://www.amazon.com/gp/profile/amzn1.account.AEWO73TIHU3FL7KCDNHR2ADTICHA/ref=cm_cr_arp_d_gw_btm?ie=UTF8","5","","https://www.amazon.com/gp/customer-reviews/R3Q2V4Y3AUSUU9/ref=cm_cr_arp_d_rvw_ttl?ie=UTF8&ASIN=B09WZBPX7K","B09WZBPX7K","I agree with all the pros. This device is outstanding. The only con is charging.<br>We have frequent visitors to our front porch which means frequent doorbell activations. Even so, the battery lasts at least 3 months.<br>Charging: The device must be opened to release the battery, which then has to be connected to charging power via a micro usb. There is no external port to connect a charging cable, like the older Rings had. There is a screw at the bottom which secures the silver cover. Remove the cover and the battery comes out easily. The usb port is at the top of the battery. Today we pulled the battery at 30% and it took 5 hours to fully charge. To reassemble, the battery goes back inside, install the silver cover, and secure the cover and battery with a tiny screw. We have our Ring in a security frame which adds one more layer of metal to put the little screw at the bottom through.  The battery hole does not fully align with the cover hole so it's necessary to kind of put a push pressure the direction needed to line them up. The hole is at the bottom, so to see if they're lined up requires neck craning and a flashlight. Oh my goodness that little screw is hard to put in.<br>Ring does not currently offer a solar charger for this model. I'm not sure how they could design one, with the port all the way at the top, deep inside the device, but I'm no engineer. This model would be a dream if it had an optional solar charger.","Reviewed in the United States on January 6, 2024","Configuration: Doorbell only","Verified Purchase","5 people found this helpful","","","[]","[]"
"R9IA4GHGZPOM4","Sofia Carty","https://www.amazon.com/gp/profile/amzn1.account.AFUIK7UG377GYECKAWS7C3HFGLDQ/ref=cm_cr_arp_d_gw_btm?ie=UTF8","5","","https://www.amazon.com/gp/customer-reviews/R9IA4GHGZPOM4/ref=cm_cr_arp_d_rvw_ttl?ie=UTF8&ASIN=B09WZBPX7K","B09WZBPX7K","We love the Ring doorbell.  Highly recommend it.  Fast and easy installation and the app is very easy to use.","Reviewed in the United States on June 2, 2024","Configuration: Doorbell only","Verified Purchase","2 people found this helpful","","","[]","[]"
"R1PNTHR3KTEDG1","Amazon Customer","https://www.amazon.com/gp/profile/amzn1.account.AH4TPOG6VAXFBO72IU7DA3TGDIAA/ref=cm_cr_arp_d_gw_btm?ie=UTF8","5","","https://www.amazon.com/gp/customer-reviews/R1PNTHR3KTEDG1/ref=cm_cr_arp_d_rvw_ttl?ie=UTF8&ASIN=B09WZBPX7K","B09WZBPX7K","I absolutely love this thing in fact I'm going to get one for my garage and one for the back door","Reviewed in the United States on June 2, 2024","Configuration: Doorbell only","Verified Purchase","One person found this helpful","","","[]","[]"
"R3SIUYEE2OP50Z","Elizabeth","https://www.amazon.com/gp/profile/amzn1.account.AEMT5JHOJQLRCB5IAYDZPY6WTGJA/ref=cm_cr_arp_d_gw_btm?ie=UTF8","5","","https://www.amazon.com/gp/customer-reviews/R3SIUYEE2OP50Z/ref=cm_cr_arp_d_rvw_ttl?ie=UTF8&ASIN=B09WZBPX7K","B09WZBPX7K","This is a great product. I have a 91 year old Dad and while I’m at work, I can see every one that comes to the front door and can speak to them as well. I can see the houses across the street and both driveways to the right and left. It’s a great product for the money. I don’t know why I didn’t buy this sooner than I did!!!","Reviewed in the United States on April 26, 2024","Configuration: Doorbell only","Verified Purchase","","","","[]","[]"
"R32OOUUSMT0K1U","SMarkway","https://www.amazon.com/gp/profile/amzn1.account.AE6QJG3LDZXILUVOEKOIXSE37FFA/ref=cm_cr_arp_d_gw_btm?ie=UTF8","5","","https://www.amazon.com/gp/customer-reviews/R32OOUUSMT0K1U/ref=cm_cr_arp_d_rvw_ttl?ie=UTF8&ASIN=B09WZBPX7K","B09WZBPX7K","Don’t let the “battery powered” statement cause you to pause.  The rechargeable battery will last at least 2 months before needing an overnight recharge.  Your phone or any other Alexa product you have in the home eliminate the need to hook up a doorbell.  The only installation simpler is if they would put some peel and stick tape on the back of the product.","Reviewed in the United States on May 2, 2024","Configuration: Doorbell only","Verified Purchase","","","","[]","[]"
"R27EYTN1YU5H8H","W Meehan","https://www.amazon.com/gp/profile/amzn1.account.AGYFLQPX67IAQLTEIFCE7YSSKSLA/ref=cm_cr_arp_d_gw_btm?ie=UTF8","5","","https://www.amazon.com/gp/customer-reviews/R27EYTN1YU5H8H/ref=cm_cr_arp_d_rvw_ttl?ie=UTF8&ASIN=B09WZBPX7K","B09WZBPX7K","Easy to install. Works great, no problems. Recommend highly","Reviewed in the United States on June 5, 2024","Configuration: Doorbell only","Verified Purchase","","","","[]","[]"
"R2TONHKRZB6AA9","Jacob","https://www.amazon.com/gp/profile/amzn1.account.AEKXKTK4BXWB2V764TTIA7U4EM3A/ref=cm_cr_arp_d_gw_btm?ie=UTF8","5","","https://www.amazon.com/gp/customer-reviews/R2TONHKRZB6AA9/ref=cm_cr_arp_d_rvw_ttl?ie=UTF8&ASIN=B09WZBPX7K","B09WZBPX7K","Added a solar panel to it &amp; stays charged, great picture head to toe, install instructions could be better showing which screws go where my only complaint haha","Reviewed in the United States on May 27, 2024","Configuration: Doorbell only","Verified Purchase","One person found this helpful","","","[]","[]"
"R15DH3MMDVDM6Y","The Waterman","https://www.amazon.com/gp/profile/amzn1.account.AE3PZG5WZILKR44J6X2T5C5XISGA/ref=cm_cr_arp_d_gw_btm?ie=UTF8","5","","https://www.amazon.com/gp/customer-reviews/R15DH3MMDVDM6Y/ref=cm_cr_arp_d_rvw_ttl?ie=UTF8&ASIN=B09WZBPX7K","B09WZBPX7K","We needed a little security on our home, especially while we are away.  Now we can see what's going on at any time day or night.  The Ring subscription works great too.  And why can't they make a cell phone battery that last like the one in the Ring Door Bell?  At the current rate it won't need charging for 5 to 6 months!","Reviewed in the United States on May 3, 2024","Configuration: Doorbell only","Verified Purchase","","","","[]","[]"
"RE9O8WXQW1PR2","Clemson ","https://www.amazon.com/gp/profile/amzn1.account.AH5H5S4JX4DWO76FRSB7U6F4QZBQ/ref=cm_cr_arp_d_gw_btm?ie=UTF8","5","","https://www.amazon.com/gp/customer-reviews/RE9O8WXQW1PR2/ref=cm_cr_arp_d_rvw_ttl?ie=UTF8&ASIN=B09WZBPX7K","B09WZBPX7K","Like it. Wish it was a little smaller so it could fit near the old doorbell is. Now to mount on my brick to mount it.  But like the quality of the videos.","Reviewed in the United States on May 28, 2024","Configuration: Doorbell only","Verified Purchase","One person found this helpful","","","[]","[]"
"RZ6TWZTAQB5G9","Kelly Blaz","https://www.amazon.com/gp/profile/amzn1.account.AFN2PB3ISNE3KWAJIJZTXGHVQDFA/ref=cm_cr_arp_d_gw_btm?ie=UTF8","5","","https://www.amazon.com/gp/customer-reviews/RZ6TWZTAQB5G9/ref=cm_cr_arp_d_rvw_ttl?ie=UTF8&ASIN=B09WZBPX7K","B09WZBPX7K","I have purchased two other brand wireless camera doorbells in the past. They were terrible and I ended up returning them. This one is perfect. I literally have no complaints. It is always connected and because I also purchased the optional solar panel, I have never had to charge this doorbell. I have had it for over a year.","Reviewed in the United States on May 16, 2024","Configuration: Doorbell only","Verified Purchase","","","","[]","[]"
"R23V6MLBJDFW7F","Bri ","https://www.amazon.com/gp/profile/amzn1.account.AH3CAS7Z27KGUWK4GPL3P5DFPGTA/ref=cm_cr_arp_d_gw_btm?ie=UTF8","5","","https://www.amazon.com/gp/customer-reviews/R23V6MLBJDFW7F/ref=cm_cr_arp_d_rvw_ttl?ie=UTF8&ASIN=B09WZBPX7K","B09WZBPX7K","So easy to install and set up. Give us peace of mind","Reviewed in the United States on June 3, 2024","Configuration: Doorbell only","Verified Purchase","","","","[]","[]"
"R1KGJTWFDAFECK","C. BELL","https://www.amazon.com/gp/profile/amzn1.account.AGQQEKO6HZ2UQ3OSD7DVQV3BGE3A/ref=cm_cr_arp_d_gw_btm?ie=UTF8","5","","https://www.amazon.com/gp/customer-reviews/R1KGJTWFDAFECK/ref=cm_cr_arp_d_rvw_ttl?ie=UTF8&ASIN=B09WZBPX7K","B09WZBPX7K","I purchased this a while ago. I was intimidated, because, I thought it was going to be hard to program. It was real ease to setup. I purchased this with another item to hang on the door and a separate door bell. I love this setup. It was an excellent buy.","Reviewed in the United States on May 19, 2024","Configuration: Doorbell only","Verified Purchase","","","","[]","[]"
"RCEMR8BETIEGW","Glen A. Warn","https://www.amazon.com/gp/profile/amzn1.account.AFCZ577KIKPHY4TJ57LNMH2ISLMQ/ref=cm_cr_arp_d_gw_btm?ie=UTF8","4","","https://www.amazon.com/gp/customer-reviews/RCEMR8BETIEGW/ref=cm_cr_arp_d_rvw_ttl?ie=UTF8&ASIN=B09WZBPX7K","B09WZBPX7K","This is an upgrade over my Ring 2<br>It is not significantly better though which is what I hoped for given that is is several years newer.<br>Other notes about using Ring.<br>If you have a few devices (like I do) 2 doorbells 1 camera and 1 chime you should really do that annual subscription which is cheaper than doing a few of these devices at around $30 / year.<br>I am still somewhat disappointed with motion detection (people coming or going without getting recorded or just the tail end of this.)  I did convert to AC power years ago and have the motion sensitivity set to high but it is still disappointing at times and I do IT for a living and have very low db wifi signal to my doorbells so poor wifi is not the source of these issues either.","Reviewed in the United States on December 16, 2023","Configuration: Doorbell only","Verified Purchase","3 people found this helpful","","","[]","[]"